{"schema_id": "P3", "difficulty": "Medium", "attempt": 3, "stage": "exception", "error": "[Errno 11001] getaddrinfo failed", "idea_plan": {"schema_id": "P3", "idea_summary": "An object starts from rest and is subject to a force described by a Force-Time graph which has a positive region followed by a negative region of equal area. The candidate must determine the final displacement and velocity state of the object.\n", "function_or_object_type": ["physical system", "piecewise continuous function"], "constraints_used": ["value at a point (starts from rest)", "inequality / bound (area of positive region equals area of negative region)"], "what_is_asked": ["compare two quantities (final vs initial position/velocity)"], "intended_wrong_paths": ["Interpreting the graph as Velocity-Time (concluding the object returns to the start).", "Interpreting the graph as Displacement-Time (concluding the object moved out and back).", "Correctly identifying zero final velocity but incorrectly assuming zero net displacement because the \"net force\" area is zero."], "difficulty_rationale": "It requires a two-step conceptual integration: Force → Acceleration → Velocity (Area 1) → Displacement (Area 2). The candidate must realize that while the net change in momentum is zero (stops at the end), the velocity was positive throughout the entire motion, implying maximum displacement rather than zero displacement.\n", "mcq_viability": {"viable": true, "reason": "The distractors map perfectly to different levels of derivative confusion (treating F as v, or F as x), creating distinct, plausible physical descriptions."}, "_raw_text": "schema_id: P3\nidea_summary: >\n  An object starts from rest and is subject to a force described by a Force-Time graph which has a positive region followed by a negative region of equal area. The candidate must determine the final displacement and velocity state of the object.\nfunction_or_object_type:\n  - physical system\n  - piecewise continuous function\nconstraints_used:\n  - value at a point (starts from rest)\n  - inequality / bound (area of positive region equals area of negative region)\nwhat_is_asked:\n  - compare two quantities (final vs initial position/velocity)\nintended_wrong_paths:\n  - Interpreting the graph as Velocity-Time (concluding the object returns to the start).\n  - Interpreting the graph as Displacement-Time (concluding the object moved out and back).\n  - Correctly identifying zero final velocity but incorrectly assuming zero net displacement because the \"net force\" area is zero.\ndifficulty_rationale: >\n  It requires a two-step conceptual integration: Force → Acceleration → Velocity (Area 1) → Displacement (Area 2). The candidate must realize that while the net change in momentum is zero (stops at the end), the velocity was positive throughout the entire motion, implying maximum displacement rather than zero displacement.\nmcq_viability:\n  viable: yes\n  reason: >\n    The distractors map perfectly to different levels of derivative confusion (treating F as v, or F as x), creating distinct, plausible physical descriptions."}, "created_at": "2025-12-18T01:19:32.075569"}
