{"id": "M3-Medium-157893800c", "schema_id": "M3", "difficulty": "Medium", "idea_plan": {"schema_id": "M3", "idea_summary": "The student is presented with a cubic polynomial containing two unknown parameters. The question states that the graph of the function intersects the x-axis at exactly two distinct points. The student must use differentiation to find the stationary points in terms of the parameters and then apply the logic that for exactly two roots to exist, one stationary point must lie on the x-axis (value is zero).\n", "function_or_object_type": ["polynomial (cubic)"], "constraints_used": ["derivative at a point (stationary point condition)", "value at a point (local extremum must be zero)"], "what_is_asked": ["identify a relationship between the two parameters"], "intended_wrong_paths": ["Assuming the condition implies a single repeated root at the origin only.", "Attempting to use a quadratic discriminant on the cubic function directly.", "Identifying the stationary points correctly but setting the wrong one (or both simultaneously) to zero without considering the algebraic structure.", "Arithmetic errors in substituting the x-value of the stationary point back into the original cubic equation (e.g., sign errors with cubes)."], "difficulty_rationale": "This problem is 'Medium' because it moves beyond standard curve sketching. It requires the candidate to translate a geometric condition (\"two distinct intersections\") into a calculus constraint (\"local max or min value is zero\") without being explicitly told to differentiate or find stationary points.\n", "mcq_viability": {"viable": true, "reason": "The resulting relationship between parameters usually involves powers (e.g., cubes and squares), allowing for distinct, plausible distractors based on missing factors of 2 or sign errors."}, "_raw_text": "```yaml\nschema_id: M3\nidea_summary: >\n  The student is presented with a cubic polynomial containing two unknown parameters. The question states that the graph of the function intersects the x-axis at exactly two distinct points. The student must use differentiation to find the stationary points in terms of the parameters and then apply the logic that for exactly two roots to exist, one stationary point must lie on the x-axis (value is zero).\nfunction_or_object_type:\n  - polynomial (cubic)\nconstraints_used:\n  - derivative at a point (stationary point condition)\n  - value at a point (local extremum must be zero)\nwhat_is_asked:\n  - identify a relationship between the two parameters\nintended_wrong_paths:\n  - Assuming the condition implies a single repeated root at the origin only.\n  - Attempting to use a quadratic discriminant on the cubic function directly.\n  - Identifying the stationary points correctly but setting the wrong one (or both simultaneously) to zero without considering the algebraic structure.\n  - Arithmetic errors in substituting the x-value of the stationary point back into the original cubic equation (e.g., sign errors with cubes).\ndifficulty_rationale: >\n  This problem is 'Medium' because it moves beyond standard curve sketching. It requires the candidate to translate a geometric condition (\"two distinct intersections\") into a calculus constraint (\"local max or min value is zero\") without being explicitly told to differentiate or find stationary points.\nmcq_viability:\n  viable: yes\n  reason: >\n    The resulting relationship between parameters usually involves powers (e.g., cubes and squares), allowing for distinct, plausible distractors based on missing factors of 2 or sign errors.\n```"}, "question_package": {"question": {"stem": "The curve with equation$$y = x^3 - 3ax^2 + b$$where$a$and$b$are non-zero constants, intersects the$x$-axis at exactly two distinct points.\nWhich of the following expresses$b$in terms of$a$?\n", "options": {"A": "$b = a^3$", "B": "$b = 2a^3$", "C": "$b = 4a^3$", "D": "$b = -2a^3$", "E": "$b = -4a^3$"}, "correct_option": "C"}, "solution": {"reasoning": "For a cubic polynomial to intersect the$x$-axis at exactly two distinct points, one of its stationary points must lie on the$x$-axis (i.e., the local maximum or minimum value must be zero).\nWe differentiate to find the stationary points:$$\\frac{dy}{dx} = 3x^2 - 6ax = 3x(x - 2a)$$The stationary points occur at$x = 0$and$x = 2a$.\nWe evaluate the function at these points: 1. At$x = 0$,$y = 0^3 - 3a(0)^2 + b = b$. 2. At$x = 2a$,$y = (2a)^3 - 3a(2a)^2 + b = 8a^3 - 12a^3 + b = b - 4a^3$.\nThe problem states that$b$is non-zero, so the stationary point at$x = 0$cannot be on the$x$-axis. Therefore, the stationary point at$x = 2a$must be the one on the axis.\nSetting$y(2a) = 0$:$$b - 4a^3 = 0 \\implies b = 4a^3$$", "key_insight": "A cubic equation has exactly two distinct roots if and only if one of its local extrema equals zero.\n", "distractor_map": {"A": "Guessing the coefficient is 1, or arithmetic error.", "B": "Incorrectly using the inflection point ($x=a$) instead of the stationary point, giving $b - 2a^3 = 0$.", "C": "Correct.", "D": "Sign error when rearranging $b - 2a^3 = 0$ or incorrect substitution.", "E": "Sign error when rearranging $b - 4a^3 = 0$."}}, "_raw_text": "```yaml\nquestion:\n  stem: >\n    The curve with equation\n    $$ y = x^3 - 3ax^2 + b $$\n    where $a$ and $b$ are non-zero constants, intersects the $x$-axis at exactly two distinct points.\n    \n    Which of the following expresses $b$ in terms of $a$?\n  options:\n    A: $b = a^3$\n    B: $b = 2a^3$\n    C: $b = 4a^3$\n    D: $b = -2a^3$\n    E: $b = -4a^3$\n  correct_option: C\nsolution:\n  reasoning: >\n    For a cubic polynomial to intersect the $x$-axis at exactly two distinct points, one of its stationary points must lie on the $x$-axis (i.e., the local maximum or minimum value must be zero).\n    \n    We differentiate to find the stationary points:\n    $$ \\frac{dy}{dx} = 3x^2 - 6ax = 3x(x - 2a) $$\n    The stationary points occur at $x = 0$ and $x = 2a$.\n    \n    We evaluate the function at these points:\n    1. At $x = 0$, $y = 0^3 - 3a(0)^2 + b = b$.\n    2. At $x = 2a$, $y = (2a)^3 - 3a(2a)^2 + b = 8a^3 - 12a^3 + b = b - 4a^3$.\n    \n    The problem states that $b$ is non-zero, so the stationary point at $x = 0$ cannot be on the $x$-axis. Therefore, the stationary point at $x = 2a$ must be the one on the axis.\n    \n    Setting $y(2a) = 0$:\n    $$ b - 4a^3 = 0 \\implies b = 4a^3 $$\n  key_insight: >\n    A cubic equation has exactly two distinct roots if and only if one of its local extrema equals zero.\n  distractor_map:\n    A: Guessing the coefficient is 1, or arithmetic error.\n    B: Incorrectly using the inflection point ($x=a$) instead of the stationary point, giving $b - 2a^3 = 0$.\n    C: Correct.\n    D: Sign error when rearranging $b - 2a^3 = 0$ or incorrect substitution.\n    E: Sign error when rearranging $b - 4a^3 = 0$.\n```"}, "verifier_report": {"verdict": "PASS", "confidence": "high", "notes": ["The solution is mathematically correct and unique.", "The condition \"exactly two distinct points\" correctly implies a local extremum lies on the x-axis.", "The constraint \"b is non-zero\" correctly eliminates the trivial solution at x=0.", "Difficulty and style are well-calibrated for ESAT/ENGAA (requires conceptual insight rather than heavy calculation)."], "_raw_text": "verdict: PASS\nconfidence: high\nnotes:\n  - The solution is mathematically correct and unique.\n  - The condition \"exactly two distinct points\" correctly implies a local extremum lies on the x-axis.\n  - The constraint \"b is non-zero\" correctly eliminates the trivial solution at x=0.\n  - Difficulty and style are well-calibrated for ESAT/ENGAA (requires conceptual insight rather than heavy calculation)."}, "style_report": {"verdict": "PASS", "scores": {"authenticity": 10, "one_idea_purity": 10, "no_calculator": 10, "elegance": 9, "distractor_realism": 10, "plausibility": 10}, "summary": "This question is an excellent example of an ESAT/ENGAA-style problem, requiring a key conceptual insight about cubic graphs and their roots, with elegant, no-calculator arithmetic and well-designed distractors.", "_raw_text": "verdict: PASS\nscores:\n  authenticity: 10\n  one_idea_purity: 10\n  no_calculator: 10\n  elegance: 9\n  distractor_realism: 10\n  plausibility: 10\nsummary: >\n  This question is an excellent example of an ESAT/ENGAA-style problem, requiring a key conceptual insight about cubic graphs and their roots, with elegant, no-calculator arithmetic and well-designed distractors."}, "models": {"designer": "gemini-3-pro-preview", "implementer": "gemini-3-pro-preview", "verifier": "gemini-3-pro-preview", "style_judge": "gemini-2.5-flash"}, "attempts": 1, "created_at": "2025-12-19T02:13:09.145117", "token_usage": {"prompt_tokens": 8536, "candidates_tokens": 1181, "total_tokens": 22030}}
