{"id": "M7-Medium-9d4e3e4573", "schema_id": "M7", "difficulty": "Medium", "idea_plan": {"schema_id": "M7", "idea_summary": "The candidate must determine the maximum value of a linear expression involving two variables, subject to a constraint equation that describes a circle with a non-origin center. The efficient solution requires interpreting the linear expression as a family of parallel lines and finding the member of that family tangent to the circle using the distance-from-point-to-line concept.\n", "function_or_object_type": ["polynomial (linear)", "geometric (circle)"], "constraints_used": ["value at a point (tangency)", "inequality / bound (radius constraint)"], "what_is_asked": ["determine a maximum or minimum"], "intended_wrong_paths": ["Setting one variable to zero to check axis intercepts (ignoring the tangent point).", "Ignoring the offset of the circle's center (treating it as centered at the origin).", "Attempting to substitute one variable into the other and solving the resulting quadratic for the discriminant, leading to arithmetic errors under time pressure."], "difficulty_rationale": "The problem is computationally heavy if approached via calculus or algebraic substitution but trivial if the geometric relationship (distance from center to line equals radius) is recognized. This fits the \"Medium\" tier by testing insight over process.\n", "mcq_viability": {"viable": true, "reason": "Common errors like checking intercepts or forgetting the center shift produce clean, integer-adjacent incorrect answers that function as strong distractors."}, "_raw_text": "```yaml\nschema_id: M7\nidea_summary: >\n  The candidate must determine the maximum value of a linear expression involving two variables, subject to a constraint equation that describes a circle with a non-origin center. The efficient solution requires interpreting the linear expression as a family of parallel lines and finding the member of that family tangent to the circle using the distance-from-point-to-line concept.\nfunction_or_object_type:\n  - polynomial (linear)\n  - geometric (circle)\nconstraints_used:\n  - value at a point (tangency)\n  - inequality / bound (radius constraint)\nwhat_is_asked:\n  - determine a maximum or minimum\nintended_wrong_paths:\n  - Setting one variable to zero to check axis intercepts (ignoring the tangent point).\n  - Ignoring the offset of the circle's center (treating it as centered at the origin).\n  - Attempting to substitute one variable into the other and solving the resulting quadratic for the discriminant, leading to arithmetic errors under time pressure.\ndifficulty_rationale: >\n  The problem is computationally heavy if approached via calculus or algebraic substitution but trivial if the geometric relationship (distance from center to line equals radius) is recognized. This fits the \"Medium\" tier by testing insight over process.\nmcq_viability:\n  viable: yes\n  reason: >\n    Common errors like checking intercepts or forgetting the center shift produce clean, integer-adjacent incorrect answers that function as strong distractors.\n```"}, "question_package": {"question": {"stem": "The real variables$x$and$y$satisfy the equation:$$x^2 - 4x + y^2 - 6y = 12$$What is the maximum possible value of$3x + 4y$?\n", "options": {"A": "18", "B": "25", "C": "33", "D": "38", "E": "43"}, "correct_option": "E"}, "solution": {"reasoning": "First, we determine the properties of the circle by completing the square for both variables:$$(x^2 - 4x) + (y^2 - 6y) = 12$$$$(x-2)^2 - 4 + (y-3)^2 - 9 = 12$$$$(x-2)^2 + (y-3)^2 = 25$$This represents a circle with centre$C(2, 3)$and radius$r = \\sqrt{25} = 5$.\n\nLet$k = 3x + 4y$. This equation represents a family of parallel lines with gradient$-\\frac{3}{4}$. The maximum value of$k$occurs when the line is tangent to the circle.\n\nFor the line$3x + 4y - k = 0$to be tangent to the circle, the perpendicular distance from the centre$(2, 3)$to the line must equal the radius$5$.\nUsing the distance formula$d = \\frac{|ax_1 + by_1 + c|}{\\sqrt{a^2 + b^2}}$:$$\\frac{|3(2) + 4(3) - k|}{\\sqrt{3^2 + 4^2}} = 5$$$$\\frac{|6 + 12 - k|}{\\sqrt{25}} = 5$$$$\\frac{|18 - k|}{5} = 5$$$$|18 - k| = 25$$This gives two possible values for$k$:$$18 - k = 25 \\implies k = -7$$$$18 - k = -25 \\implies k = 43$$The maximum value is$43$.\n\nHence the correct answer is E.\n", "key_insight": "The maximum value of a linear expression$ax+by$subject to a circle constraint occurs when the line$ax+by=k$is tangent to the circle; geometrically, the distance from the centre to this line equals the radius.\n", "distractor_map": {"A": "The value of the expression at the centre of the circle $(2, 3)$, or at the x-intercept $(6,0)$.", "B": "The maximum value if the circle were centred at the origin (ignoring the translation).", "C": "The value calculated at the point of maximum x-coordinate on the circle, $(7, 3)$.", "D": "The value calculated at the point of maximum y-coordinate on the circle, $(2, 8)$.", "E": "Correct."}}, "_raw_text": "```yaml\nquestion:\n  stem: >\n    The real variables $x$ and $y$ satisfy the equation:\n\n    $$ x^2 - 4x + y^2 - 6y = 12 $$\n\n    What is the maximum possible value of $3x + 4y$?\n  options:\n    A: 18\n    B: 25\n    C: 33\n    D: 38\n    E: 43\n  correct_option: E\nsolution:\n  reasoning: >\n    First, we determine the properties of the circle by completing the square for both variables:\n\n    $$ (x^2 - 4x) + (y^2 - 6y) = 12 $$\n\n    $$ (x-2)^2 - 4 + (y-3)^2 - 9 = 12 $$\n\n    $$ (x-2)^2 + (y-3)^2 = 25 $$\n\n    This represents a circle with centre $C(2, 3)$ and radius $r = \\sqrt{25} = 5$.\n\n\n    Let $k = 3x + 4y$. This equation represents a family of parallel lines with gradient $-\\frac{3}{4}$. The maximum value of $k$ occurs when the line is tangent to the circle.\n\n\n    For the line $3x + 4y - k = 0$ to be tangent to the circle, the perpendicular distance from the centre $(2, 3)$ to the line must equal the radius $5$.\n\n    Using the distance formula $d = \\frac{|ax_1 + by_1 + c|}{\\sqrt{a^2 + b^2}}$:\n\n    $$ \\frac{|3(2) + 4(3) - k|}{\\sqrt{3^2 + 4^2}} = 5 $$\n\n    $$ \\frac{|6 + 12 - k|}{\\sqrt{25}} = 5 $$\n\n    $$ \\frac{|18 - k|}{5} = 5 $$\n\n    $$ |18 - k| = 25 $$\n\n\n    This gives two possible values for $k$:\n\n    $$ 18 - k = 25 \\implies k = -7 $$\n\n    $$ 18 - k = -25 \\implies k = 43 $$\n\n\n    The maximum value is $43$.\n\n\n    Hence the correct answer is E.\n  key_insight: >\n    The maximum value of a linear expression $ax+by$ subject to a circle constraint occurs when the line $ax+by=k$ is tangent to the circle; geometrically, the distance from the centre to this line equals the radius.\n  distractor_map:\n    A: The value of the expression at the centre of the circle $(2, 3)$, or at the x-intercept $(6,0)$.\n    B: The maximum value if the circle were centred at the origin (ignoring the translation).\n    C: The value calculated at the point of maximum x-coordinate on the circle, $(7, 3)$.\n    D: The value calculated at the point of maximum y-coordinate on the circle, $(2, 8)$.\n    E: Correct.\n```"}, "verifier_report": {"verdict": "PASS", "confidence": "high", "notes": ["The mathematical derivation is correct; the problem involves standard circle geometry and linear optimization.", "The numbers are well-chosen (Pythagorean triples 3-4-5), making it solvable without a calculator in the allotted time.", "The distractors are strong, corresponding to specific logical errors (evaluating at the center, evaluating at max-x or max-y coordinates, or ignoring the center shift)."], "_raw_text": "verdict: PASS\nconfidence: high\nnotes:\n  - The mathematical derivation is correct; the problem involves standard circle geometry and linear optimization.\n  - The numbers are well-chosen (Pythagorean triples 3-4-5), making it solvable without a calculator in the allotted time.\n  - The distractors are strong, corresponding to specific logical errors (evaluating at the center, evaluating at max-x or max-y coordinates, or ignoring the center shift)."}, "style_report": {"verdict": "PASS", "scores": {"authenticity": 10, "one_idea_purity": 10, "no_calculator": 10, "elegance": 9, "distractor_realism": 10, "plausibility": 10}, "summary": "This question is an excellent example of an ESAT/ENGAA-style problem. It tests a core geometric concept with clean, no-calculator arithmetic and highly realistic distractors that target common misconceptions.", "_raw_text": "verdict: PASS\nscores:\n  authenticity: 10\n  one_idea_purity: 10\n  no_calculator: 10\n  elegance: 9\n  distractor_realism: 10\n  plausibility: 10\nsummary: >\n  This question is an excellent example of an ESAT/ENGAA-style problem. It tests a core geometric concept with clean, no-calculator arithmetic and highly realistic distractors that target common misconceptions."}, "models": {"designer": "gemini-3-pro-preview", "implementer": "gemini-3-pro-preview", "verifier": "gemini-3-pro-preview", "style_judge": "gemini-2.5-flash"}, "attempts": 1, "created_at": "2025-12-19T01:19:34.033464", "token_usage": {"prompt_tokens": 8987, "candidates_tokens": 1238, "total_tokens": 18987}}
