{"id": "M7-Medium-9a115a992b", "schema_id": "M7", "difficulty": "Medium", "idea_plan": {"schema_id": "M7", "idea_summary": "The student is asked to find the maximum value of a linear expression (e.g., x + y) given that x and y satisfy the equation of a circle. The efficient solution requires visualising the linear expression as a family of parallel lines and identifying the tangent line using the perpendicular distance from the circle's centre, rather than substituting variables to solve a messy optimisation problem via calculus.\n", "function_or_object_type": ["geometric (circle)", "polynomial (linear expression)"], "constraints_used": ["value at a point (tangency condition)", "symmetry condition"], "what_is_asked": ["determine a maximum or minimum"], "intended_wrong_paths": ["Assuming the maximum occurs when both x and y are individually maximised (treating variables as independent).", "Attempting to substitute one variable into the quadratic constraint and solving for the discriminant, leading to arithmetic errors.", "Calculating the value at the centre of the circle but neglecting the radius component."], "difficulty_rationale": "The problem is technically solvable via standard A-level calculus or discriminant methods, but the algebra becomes cumbersome and time-consuming without a calculator. The geometric insight (distance from point to line) reduces the problem to a few lines of simple working, distinguishing candidates who can switch reasoning modes.\n", "mcq_viability": {"viable": true, "reason": "The 'independent variable' fallacy yields a clean, plausible number that serves as a strong distractor, distinct from the correct surd-based answer."}, "_raw_text": "```yaml\nschema_id: M7\nidea_summary: >\n  The student is asked to find the maximum value of a linear expression (e.g., x + y) given that x and y satisfy the equation of a circle. The efficient solution requires visualising the linear expression as a family of parallel lines and identifying the tangent line using the perpendicular distance from the circle's centre, rather than substituting variables to solve a messy optimisation problem via calculus.\nfunction_or_object_type:\n  - geometric (circle)\n  - polynomial (linear expression)\nconstraints_used:\n  - value at a point (tangency condition)\n  - symmetry condition\nwhat_is_asked:\n  - determine a maximum or minimum\nintended_wrong_paths:\n  - Assuming the maximum occurs when both x and y are individually maximised (treating variables as independent).\n  - Attempting to substitute one variable into the quadratic constraint and solving for the discriminant, leading to arithmetic errors.\n  - Calculating the value at the centre of the circle but neglecting the radius component.\ndifficulty_rationale: >\n  The problem is technically solvable via standard A-level calculus or discriminant methods, but the algebra becomes cumbersome and time-consuming without a calculator. The geometric insight (distance from point to line) reduces the problem to a few lines of simple working, distinguishing candidates who can switch reasoning modes.\nmcq_viability:\n  viable: yes\n  reason: >\n    The 'independent variable' fallacy yields a clean, plausible number that serves as a strong distractor, distinct from the correct surd-based answer.\n```"}, "question_package": {"question": {"stem": "Real variables$x$and$y$satisfy the equation$$(x - 2)^2 + (y - 1)^2 = 4$$What is the maximum value of the expression$x + y$?\n", "options": {"A": "5", "B": "7", "C": "3 + \\sqrt{2}", "D": "3 + 2\\sqrt{2}", "E": "3 + 4\\sqrt{2}"}, "correct_option": "D"}, "solution": {"reasoning": "The equation describes a circle with centre$(2, 1)$and radius$r = 2$. Let$k = x + y$. This represents a family of parallel lines with gradient$-1$. The maximum value of$k$corresponds to the line that is tangent to the circle in the first quadrant.\nThe perpendicular distance from the centre$(2, 1)$to the line$x + y - k = 0$must equal the radius$r = 2$. Using the point-to-line distance formula:$$\\frac{|1(2) + 1(1) - k|}{\\sqrt{1^2 + 1^2}} = 2$$$$\\frac{|3 - k|}{\\sqrt{2}} = 2$$$$|3 - k| = 2\\sqrt{2}$$For the maximum value, we select the case where$k > 3$:$$k - 3 = 2\\sqrt{2}$$$$k = 3 + 2\\sqrt{2}$$Hence the correct answer is$3 + 2\\sqrt{2}$.\n", "key_insight": "The maximum value of a linear form$ax+by$on a circle is its value at the centre plus$r\\sqrt{a^2+b^2}$.\n", "distractor_map": {"A": "Calculates the value at the centre plus the radius ($3+2$), treating the expression as a simple radial distance.", "B": "Incorrectly assumes $x$ and $y$ can be maximised independently ($x_{\\text{max}} = 2+2=4$, $y_{\\text{max}} = 1+2=3$, sum $= 7$).", "C": "Ommits the radius multiplier, adding only the gradient magnitude ($\\sqrt{2}$) to the centre value.", "D": "Correct.", "E": "Uses the square of the radius ($4$) or an arithmetic error in the distance calculation."}}, "_raw_text": "```yaml\nquestion:\n  stem: >\n    Real variables $x$ and $y$ satisfy the equation\n    $$ (x - 2)^2 + (y - 1)^2 = 4 $$\n    What is the maximum value of the expression $x + y$?\n  options:\n    A: 5\n    B: 7\n    C: 3 + \\sqrt{2}\n    D: 3 + 2\\sqrt{2}\n    E: 3 + 4\\sqrt{2}\n  correct_option: D\nsolution:\n  reasoning: >\n    The equation describes a circle with centre $(2, 1)$ and radius $r = 2$.\n    Let $k = x + y$. This represents a family of parallel lines with gradient $-1$.\n    The maximum value of $k$ corresponds to the line that is tangent to the circle in the first quadrant.\n    \n    The perpendicular distance from the centre $(2, 1)$ to the line $x + y - k = 0$ must equal the radius $r = 2$.\n    Using the point-to-line distance formula:\n    $$ \\frac{|1(2) + 1(1) - k|}{\\sqrt{1^2 + 1^2}} = 2 $$\n    $$ \\frac{|3 - k|}{\\sqrt{2}} = 2 $$\n    $$ |3 - k| = 2\\sqrt{2} $$\n    \n    For the maximum value, we select the case where $k > 3$:\n    $$ k - 3 = 2\\sqrt{2} $$\n    $$ k = 3 + 2\\sqrt{2} $$\n    \n    Hence the correct answer is $3 + 2\\sqrt{2}$.\n  key_insight: >\n    The maximum value of a linear form $ax+by$ on a circle is its value at the centre plus $r\\sqrt{a^2+b^2}$.\n  distractor_map:\n    A: Calculates the value at the centre plus the radius ($3+2$), treating the expression as a simple radial distance.\n    B: Incorrectly assumes $x$ and $y$ can be maximised independently ($x_{\\text{max}} = 2+2=4$, $y_{\\text{max}} = 1+2=3$, sum $= 7$).\n    C: Ommits the radius multiplier, adding only the gradient magnitude ($\\sqrt{2}$) to the centre value.\n    D: Correct.\n    E: Uses the square of the radius ($4$) or an arithmetic error in the distance calculation.\n```"}, "verifier_report": {"verdict": "PASS", "confidence": "high", "notes": ["The solution is mathematically correct and the answer is unique.", "The problem is a classic coordinate geometry optimization task suitable for ESAT/ENGAA.", "Solvable quickly using the distance-from-point-to-line formula or parametric equations.", "Distractors cover common conceptual errors (e.g., maximizing variables independently, confusing radius with radius squared)."], "_raw_text": "verdict: PASS\nconfidence: high\nnotes:\n  - The solution is mathematically correct and the answer is unique.\n  - The problem is a classic coordinate geometry optimization task suitable for ESAT/ENGAA.\n  - Solvable quickly using the distance-from-point-to-line formula or parametric equations.\n  - Distractors cover common conceptual errors (e.g., maximizing variables independently, confusing radius with radius squared)."}, "style_report": {"verdict": "PASS", "scores": {"authenticity": 9, "one_idea_purity": 10, "no_calculator": 10, "elegance": 9, "distractor_realism": 9, "plausibility": 10}, "summary": "This is a classic coordinate geometry optimisation problem, perfectly suited for ESAT/ENGAA. The question is concise, the solution is elegant and requires no calculator, and the distractors are well-crafted to target common misconceptions.", "_raw_text": "```yaml\nverdict: PASS\nscores:\n  authenticity: 9\n  one_idea_purity: 10\n  no_calculator: 10\n  elegance: 9\n  distractor_realism: 9\n  plausibility: 10\nsummary: >\n  This is a classic coordinate geometry optimisation problem, perfectly suited for ESAT/ENGAA. The question is concise, the solution is elegant and requires no calculator, and the distractors are well-crafted to target common misconceptions.\n```"}, "models": {"designer": "gemini-3-pro-preview", "implementer": "gemini-3-pro-preview", "verifier": "gemini-3-pro-preview", "style_judge": "gemini-2.5-flash"}, "attempts": 1, "created_at": "2025-12-19T01:54:45.825279", "token_usage": {"prompt_tokens": 8355, "candidates_tokens": 1133, "total_tokens": 20297}}
