{"id": "M2-Medium-c90f0b0f16", "schema_id": "M2", "difficulty": "Medium", "idea_plan": {"schema_id": "M2", "idea_summary": "A polynomial equation is presented that appears to be a quartic but is structured as a quadratic equation in terms of a quadratic sub-expression. The candidate must recognise the repeated sub-structure to solve for the intermediate values, then determine the total number of real solutions for the original variable by comparing these intermediate values to the range of the inner quadratic.\n", "function_or_object_type": ["polynomial"], "constraints_used": ["value at a point", "inequality / bound"], "what_is_asked": ["decide existence or uniqueness (count of real solutions)"], "intended_wrong_paths": ["Expanding the squared term to form a standard quartic equation, leading to intractable algebra.", "Solving for the values of the sub-expression and reporting the number of these values as the final answer.", "Assuming that every real value found for the sub-expression automatically yields two real solutions for the original variable, ignoring the minimum value of the inner quadratic."], "difficulty_rationale": "The problem penalises the standard algorithmic approach of \"expand and simplify\" by creating a computational mess, while the efficient path requires observing structure and understanding the mapping between the intermediate variable and the original domain.\n", "mcq_viability": {"viable": true, "reason": "The answer is a small integer (the count of roots), and common logical errors (counting intermediate roots, ignoring domain constraints) lead to predictable incorrect integers."}, "_raw_text": "```yaml\nschema_id: M2\nidea_summary: >\n  A polynomial equation is presented that appears to be a quartic but is structured as a quadratic equation in terms of a quadratic sub-expression. The candidate must recognise the repeated sub-structure to solve for the intermediate values, then determine the total number of real solutions for the original variable by comparing these intermediate values to the range of the inner quadratic.\nfunction_or_object_type:\n  - polynomial\nconstraints_used:\n  - value at a point\n  - inequality / bound\nwhat_is_asked:\n  - decide existence or uniqueness (count of real solutions)\nintended_wrong_paths:\n  - Expanding the squared term to form a standard quartic equation, leading to intractable algebra.\n  - Solving for the values of the sub-expression and reporting the number of these values as the final answer.\n  - Assuming that every real value found for the sub-expression automatically yields two real solutions for the original variable, ignoring the minimum value of the inner quadratic.\ndifficulty_rationale: >\n  The problem penalises the standard algorithmic approach of \"expand and simplify\" by creating a computational mess, while the efficient path requires observing structure and understanding the mapping between the intermediate variable and the original domain.\nmcq_viability:\n  viable: yes\n  reason: >\n    The answer is a small integer (the count of roots), and common logical errors (counting intermediate roots, ignoring domain constraints) lead to predictable incorrect integers.\n```"}, "question_package": {"question": {"stem": "What is the number of real solutions of the equation$$(x^2 - 4x)^2 + 3(x^2 - 4x) - 4 = 0$$", "options": {"A": "0", "B": "1", "C": "2", "D": "3", "E": "4"}, "correct_option": "D"}, "solution": {"reasoning": "We observe that the equation is a quadratic in terms of the expression$(x^2 - 4x)$. Let$u = x^2 - 4x$. The equation becomes:$$u^2 + 3u - 4 = 0$$Factoring this quadratic gives:$$(u + 4)(u - 1) = 0$$Thus, the possible values for$u$are$u = -4$and$u = 1$. We now solve for$x$in each case.\nCase 1:$x^2 - 4x = -4$$$x^2 - 4x + 4 = 0$$$$(x - 2)^2 = 0$$This yields exactly one real solution,$x = 2$.\nCase 2:$x^2 - 4x = 1$$$x^2 - 4x - 1 = 0$$The discriminant of this quadratic is$\\Delta = (-4)^2 - 4(1)(-1) = 16 + 4 = 20$. Since$\\Delta > 0$, there are two distinct real solutions. Note that$x=2$is not a solution here ($2^2 - 8 - 1 \\neq 0$), so these roots are distinct from the first case.\nTotal number of real solutions =$1 + 2 = 3$.\nHence the correct answer is 3.\n", "key_insight": "When an equation has a repeated algebraic structure, substituting a single variable for that structure often reveals a simpler underlying equation; however, you must check the range of the substitution to determine the number of real roots.\n"}, "distractor_map": {"A": "Incorrect guess or assuming no real solutions due to the complexity.", "B": "Corresponds to finding only the integer solution ($x=2$) and missing the irrational ones, or solving $u=1$ incorrectly as having no solutions.", "C": "Corresponds to finding the two values for $u$ ($-4$ and $1$) and reporting this count, or making a sign error in factoring $u$ that leads to one valid and one invalid case (total 2 $x$ roots).", "D": "Correct.", "E": "Corresponds to assuming that every quadratic value for $u$ yields two real solutions for $x$ (ignoring the vertex case), or counting the multiplicity of the repeated root."}, "_raw_text": "```yaml\nquestion:\n  stem: >\n    What is the number of real solutions of the equation\n    $$ (x^2 - 4x)^2 + 3(x^2 - 4x) - 4 = 0 $$\n  options:\n    A: 0\n    B: 1\n    C: 2\n    D: 3\n    E: 4\n  correct_option: D\nsolution:\n  reasoning: >\n    We observe that the equation is a quadratic in terms of the expression $(x^2 - 4x)$. Let $u = x^2 - 4x$. The equation becomes:\n    $$ u^2 + 3u - 4 = 0 $$\n    Factoring this quadratic gives:\n    $$ (u + 4)(u - 1) = 0 $$\n    Thus, the possible values for $u$ are $u = -4$ and $u = 1$. We now solve for $x$ in each case.\n\n    Case 1: $x^2 - 4x = -4$\n    $$ x^2 - 4x + 4 = 0 $$\n    $$ (x - 2)^2 = 0 $$\n    This yields exactly one real solution, $x = 2$.\n\n    Case 2: $x^2 - 4x = 1$\n    $$ x^2 - 4x - 1 = 0 $$\n    The discriminant of this quadratic is $\\Delta = (-4)^2 - 4(1)(-1) = 16 + 4 = 20$.\n    Since $\\Delta > 0$, there are two distinct real solutions. Note that $x=2$ is not a solution here ($2^2 - 8 - 1 \\neq 0$), so these roots are distinct from the first case.\n\n    Total number of real solutions = $1 + 2 = 3$.\n\n    Hence the correct answer is 3.\n  key_insight: >\n    When an equation has a repeated algebraic structure, substituting a single variable for that structure often reveals a simpler underlying equation; however, you must check the range of the substitution to determine the number of real roots.\ndistractor_map:\n  A: Incorrect guess or assuming no real solutions due to the complexity.\n  B: Corresponds to finding only the integer solution ($x=2$) and missing the irrational ones, or solving $u=1$ incorrectly as having no solutions.\n  C: Corresponds to finding the two values for $u$ ($-4$ and $1$) and reporting this count, or making a sign error in factoring $u$ that leads to one valid and one invalid case (total 2 $x$ roots).\n  D: Correct.\n  E: Corresponds to assuming that every quadratic value for $u$ yields two real solutions for $x$ (ignoring the vertex case), or counting the multiplicity of the repeated root.\n```"}, "verifier_report": {"verdict": "PASS", "confidence": "high", "notes": ["The solution is mathematically correct and unique.", "The substitution method is standard for this level.", "The distinction between the perfect square case (1 root) and the positive discriminant case (2 roots) provides a good discriminator for candidate ability.", "Difficulty is appropriate for a < 2 minute non-calculator question."], "_raw_text": "verdict: PASS\nconfidence: high\nnotes:\n  - The solution is mathematically correct and unique.\n  - The substitution method is standard for this level.\n  - The distinction between the perfect square case (1 root) and the positive discriminant case (2 roots) provides a good discriminator for candidate ability.\n  - Difficulty is appropriate for a < 2 minute non-calculator question."}, "style_report": {"verdict": "PASS", "scores": {"authenticity": 9, "one_idea_purity": 9, "no_calculator": 10, "elegance": 9, "distractor_realism": 10, "plausibility": 10}, "summary": "This question is a classic example of a disguised quadratic, testing careful analysis of the number of real roots for each resulting sub-quadratic. The arithmetic is clean, the distractors are well-chosen, and the problem is elegant in its simplicity once the substitution is identified.", "_raw_text": "```yaml\nverdict: PASS\nscores:\n  authenticity: 9\n  one_idea_purity: 9\n  no_calculator: 10\n  elegance: 9\n  distractor_realism: 10\n  plausibility: 10\nsummary: >\n  This question is a classic example of a disguised quadratic, testing careful analysis of the number of real roots for each resulting sub-quadratic. The arithmetic is clean, the distractors are well-chosen, and the problem is elegant in its simplicity once the substitution is identified.\n```"}, "models": {"designer": "gemini-3-pro-preview", "implementer": "gemini-3-pro-preview", "verifier": "gemini-3-pro-preview", "style_judge": "gemini-2.5-flash"}, "attempts": 1, "created_at": "2025-12-19T02:14:55.457861", "token_usage": {"prompt_tokens": 8609, "candidates_tokens": 1177, "total_tokens": 22864}}
