{"id": "P4-Medium-6dcf11c240", "schema_id": "P4", "difficulty": "Medium", "idea_plan": {"schema_id": "P4", "idea_summary": "Assess the change in total power dissipated by a circuit containing five identical resistors in a symmetric bridge configuration when the central 'cross-linking' resistor is removed.\n", "function_or_object_type": ["physical system (resistor network)"], "constraints_used": ["symmetry condition", "value at a point (potential balance)"], "what_is_asked": ["compare two quantities"], "intended_wrong_paths": ["assuming the central resistor carries current and contributes to the total load", "applying a heuristic that removing a component must always decrease the total power consumed", "attempting to calculate equivalent resistance using complex loop equations (Kirchhoff's laws) instead of symmetry"], "difficulty_rationale": "The problem distinguishes between candidates who perform brute-force analysis (which is time-prohibitive) and those who recognise that symmetry forces zero potential difference across the central component.\n", "mcq_viability": {"viable": true, "reason": "The correct insight leads to a ratio of 1:1 (no change), while assuming the central resistor is active leads to specific, calculable incorrect ratios that serve as strong distractors."}, "_raw_text": "```yaml\nschema_id: P4\nidea_summary: >\n  Assess the change in total power dissipated by a circuit containing five identical resistors in a symmetric bridge configuration when the central 'cross-linking' resistor is removed.\nfunction_or_object_type:\n  - physical system (resistor network)\nconstraints_used:\n  - symmetry condition\n  - value at a point (potential balance)\nwhat_is_asked:\n  - compare two quantities\nintended_wrong_paths:\n  - assuming the central resistor carries current and contributes to the total load\n  - applying a heuristic that removing a component must always decrease the total power consumed\n  - attempting to calculate equivalent resistance using complex loop equations (Kirchhoff's laws) instead of symmetry\ndifficulty_rationale: >\n  The problem distinguishes between candidates who perform brute-force analysis (which is time-prohibitive) and those who recognise that symmetry forces zero potential difference across the central component.\nmcq_viability:\n  viable: yes\n  reason: >\n    The correct insight leads to a ratio of 1:1 (no change), while assuming the central resistor is active leads to specific, calculable incorrect ratios that serve as strong distractors.\n```"}, "question_package": {"question": {"stem": "Five identical resistors, each of resistance$R$, are arranged in a bridge circuit. The circuit comprises two parallel branches connected across a DC supply of voltage$V$. Each branch consists of two resistors in series. A fifth identical resistor connects the point between the two resistors in the first branch to the point between the two resistors in the second branch. The total power dissipated by the circuit is$P$. The connecting resistor between the two branches is removed. Which expression gives the new total power dissipated?\n", "options": {"A": "$\\frac{1}{2}P$", "B": "$\\frac{4}{5}P$", "C": "$P$", "D": "$\\frac{5}{4}P$", "E": "$2P$"}, "correct_option": "C"}, "solution": {"reasoning": "The circuit is a Wheatstone bridge configuration. Let the resistors in the first branch be$R_1, R_2$and in the second branch be$R_3, R_4$. Since all five resistors are identical ($R$), the ratio of resistances in the two arms is equal:$$\\frac{R_1}{R_2} = \\frac{R}{R} = 1 \\quad \\text{and} \\quad \\frac{R_3}{R_4} = \\frac{R}{R} = 1$$The bridge is therefore balanced. This implies that the electric potential at the midpoint of the first branch is equal to the potential at the midpoint of the second branch. Consequently, the potential difference across the central connecting resistor is zero, and no current flows through it. Since the central resistor carries no current, removing it does not change the equivalent resistance of the circuit or the current drawn from the source. Hence, the total power dissipated remains$P$.\n", "key_insight": "In a symmetric bridge circuit (balanced Wheatstone bridge), no current flows through the cross-linking component, so its presence or absence does not affect the circuit's total power.\n", "distractor_map": {"A": "Incorrectly assumes the central resistor was in parallel with the rest of the circuit (halving the resistance) and that removing it doubles the resistance.", "B": "Incorrectly applies a heuristic that power is proportional to the number of components ($4$ resistors vs $5$).", "C": "Correct.", "D": "Incorrectly assumes that removing a component must reduce the total resistance (or applies an inverse counting heuristic), increasing power.", "E": "Incorrectly assumes the central resistor was in series with the rest of the circuit, such that removing it halves the total resistance."}}, "_raw_text": "```yaml\nquestion:\n  stem: >\n    Five identical resistors, each of resistance $R$, are arranged in a bridge circuit.\n    The circuit comprises two parallel branches connected across a DC supply of voltage $V$.\n    Each branch consists of two resistors in series. A fifth identical resistor connects the point between the two resistors in the first branch to the point between the two resistors in the second branch.\n    The total power dissipated by the circuit is $P$.\n    The connecting resistor between the two branches is removed.\n    Which expression gives the new total power dissipated?\n  options:\n    A: $\\frac{1}{2}P$\n    B: $\\frac{4}{5}P$\n    C: $P$\n    D: $\\frac{5}{4}P$\n    E: $2P$\n  correct_option: C\nsolution:\n  reasoning: >\n    The circuit is a Wheatstone bridge configuration. Let the resistors in the first branch be $R_1, R_2$ and in the second branch be $R_3, R_4$.\n    Since all five resistors are identical ($R$), the ratio of resistances in the two arms is equal:\n    $$ \\frac{R_1}{R_2} = \\frac{R}{R} = 1 \\quad \\text{and} \\quad \\frac{R_3}{R_4} = \\frac{R}{R} = 1 $$\n    The bridge is therefore balanced. This implies that the electric potential at the midpoint of the first branch is equal to the potential at the midpoint of the second branch.\n    Consequently, the potential difference across the central connecting resistor is zero, and no current flows through it.\n    Since the central resistor carries no current, removing it does not change the equivalent resistance of the circuit or the current drawn from the source.\n    Hence, the total power dissipated remains $P$.\n  key_insight: >\n    In a symmetric bridge circuit (balanced Wheatstone bridge), no current flows through the cross-linking component, so its presence or absence does not affect the circuit's total power.\n  distractor_map:\n    A: Incorrectly assumes the central resistor was in parallel with the rest of the circuit (halving the resistance) and that removing it doubles the resistance.\n    B: Incorrectly applies a heuristic that power is proportional to the number of components ($4$ resistors vs $5$).\n    C: Correct.\n    D: Incorrectly assumes that removing a component must reduce the total resistance (or applies an inverse counting heuristic), increasing power.\n    E: Incorrectly assumes the central resistor was in series with the rest of the circuit, such that removing it halves the total resistance.\n```"}, "verifier_report": {"verdict": "PASS", "confidence": "high", "notes": ["The question correctly identifies a balanced Wheatstone bridge scenario where the central resistor carries no current due to symmetry.", {"The solution is unique": "removing a zero-current component does not affect the equivalent resistance or power dissipation."}, "The difficulty is appropriate for ESAT/ENGAA, rewarding physical insight over calculation.", "Distractors represent plausible heuristic errors (e.g., scaling power by the number of components)."], "_raw_text": "verdict: PASS\nconfidence: high\nnotes:\n  - The question correctly identifies a balanced Wheatstone bridge scenario where the central resistor carries no current due to symmetry.\n  - The solution is unique: removing a zero-current component does not affect the equivalent resistance or power dissipation.\n  - The difficulty is appropriate for ESAT/ENGAA, rewarding physical insight over calculation.\n  - Distractors represent plausible heuristic errors (e.g., scaling power by the number of components)."}, "style_report": {"verdict": "PASS", "scores": {"authenticity": 9, "one_idea_purity": 10, "no_calculator": 10, "elegance": 10, "distractor_realism": 10, "plausibility": 10}, "summary": "This question perfectly captures the ESAT/ENGAA style, testing a key conceptual insight (balanced Wheatstone bridge) without requiring complex calculations. The distractors are well-crafted to target common misconceptions.", "_raw_text": "verdict: PASS\nscores:\n  authenticity: 9\n  one_idea_purity: 10\n  no_calculator: 10\n  elegance: 10\n  distractor_realism: 10\n  plausibility: 10\nsummary: >\n  This question perfectly captures the ESAT/ENGAA style, testing a key conceptual insight (balanced Wheatstone bridge) without requiring complex calculations. The distractors are well-crafted to target common misconceptions."}, "models": {"designer": "gemini-3-pro-preview", "implementer": "gemini-3-pro-preview", "verifier": "gemini-3-pro-preview", "style_judge": "gemini-2.5-flash"}, "attempts": 1, "created_at": "2025-12-19T02:01:12.996945", "token_usage": {"prompt_tokens": 8306, "candidates_tokens": 1065, "total_tokens": 19242}}
