{"id": "M7-Medium-768d0c9895", "schema_id": "M7", "difficulty": "Medium", "idea_plan": {"schema_id": "M7", "idea_summary": "The candidate is asked to find the maximum value of a linear expression in two variables, subject to a constraint equation that represents a circle. The efficient solution involves interpreting the linear expression as a family of parallel lines and using the geometric property that the distance from the circle's center to the tangent line equals the radius, avoiding algebraic substitution or calculus.\n", "function_or_object_type": ["quadratic relation (circle)", "linear expression"], "constraints_used": ["geometric distance (point to line)", "tangency condition"], "what_is_asked": ["determine a maximum value"], "intended_wrong_paths": ["Maximising the two variables independently (e.g., taking the maximum possible x and maximum possible y separately).", "Evaluating the expression only at the coordinates of the circle's center, ignoring the radius.", "Attempting to substitute one variable into the other to form a quadratic, leading to algebraic errors or time loss."], "difficulty_rationale": "The problem separates candidates who can translate algebra into geometry from those who rely on brute-force calculation. The algebraic path is theoretically possible but time-prohibitive without a calculator, while the geometric path is nearly instant.\n", "mcq_viability": {"viable": true, "reason": "Common misconceptions (like summing the max x and max y) produce distinct, clean values that serve as natural distractors."}, "_raw_text": "```yaml\nschema_id: M7\nidea_summary: >\n  The candidate is asked to find the maximum value of a linear expression in two variables, subject to a constraint equation that represents a circle. The efficient solution involves interpreting the linear expression as a family of parallel lines and using the geometric property that the distance from the circle's center to the tangent line equals the radius, avoiding algebraic substitution or calculus.\nfunction_or_object_type:\n  - quadratic relation (circle)\n  - linear expression\nconstraints_used:\n  - geometric distance (point to line)\n  - tangency condition\nwhat_is_asked:\n  - determine a maximum value\nintended_wrong_paths:\n  - Maximising the two variables independently (e.g., taking the maximum possible x and maximum possible y separately).\n  - Evaluating the expression only at the coordinates of the circle's center, ignoring the radius.\n  - Attempting to substitute one variable into the other to form a quadratic, leading to algebraic errors or time loss.\ndifficulty_rationale: >\n  The problem separates candidates who can translate algebra into geometry from those who rely on brute-force calculation. The algebraic path is theoretically possible but time-prohibitive without a calculator, while the geometric path is nearly instant.\nmcq_viability:\n  viable: yes\n  reason: >\n    Common misconceptions (like summing the max x and max y) produce distinct, clean values that serve as natural distractors.\n```"}, "question_package": {"question": {"stem": "Real variables$x$and$y$satisfy the equation$$x^2 + y^2 - 4x - 2y + 1 = 0$$What is the maximum value of the expression$4x + 3y$?\n", "options": {"A": "11", "B": "17", "C": "19", "D": "21", "E": "25"}, "correct_option": "D"}, "solution": {"reasoning": "First, we complete the square for the equation of the circle:$$(x^2 - 4x) + (y^2 - 2y) + 1 = 0$$$$(x-2)^2 - 4 + (y-1)^2 - 1 + 1 = 0$$$$(x-2)^2 + (y-1)^2 = 4$$This represents a circle with centre$C(2, 1)$and radius$r = 2$.\nLet$k = 4x + 3y$. This equation represents a family of parallel lines with gradient$-\\frac{4}{3}$. The maximum value of$k$corresponds to the line in this family that is tangent to the circle such that the value is maximised.\nFor the line$4x + 3y - k = 0$to be tangent to the circle, the perpendicular distance from the centre$(2, 1)$to the line must equal the radius$r=2$. Using the point-to-line distance formula:$$\\frac{|4(2) + 3(1) - k|}{\\sqrt{4^2 + 3^2}} = 2$$$$\\frac{|11 - k|}{5} = 2$$$$|11 - k| = 10$$This yields two possible values for$k$:$$11 - k = 10 \\implies k = 1$$$$11 - k = -10 \\implies k = 21$$The maximum value is$21$. Hence the correct answer is 21.\n", "key_insight": "The maximum value of a linear expression$ax+by$on a circle occurs when the line$ax+by=k$is tangent to the circle, meaning the perpendicular distance from the centre to the line equals the radius.\n", "distractor_map": {"A": "Evaluates the expression at the centre of the circle $(2, 1)$, ignoring the radius.", "B": "Evaluates the expression at the point on the circle with the maximum $y$-coordinate, $(2, 3)$.", "C": "Evaluates the expression at the point on the circle with the maximum $x$-coordinate, $(4, 1)$.", "D": "Correct answer.", "E": "Incorrectly assumes the maximum occurs at the intersection of the maximum possible $x$ ($x=4$) and maximum possible $y$ ($y=3$)."}}, "_raw_text": "```yaml\nquestion:\n  stem: >\n    Real variables $x$ and $y$ satisfy the equation\n    $$ x^2 + y^2 - 4x - 2y + 1 = 0 $$\n    What is the maximum value of the expression $4x + 3y$?\n  options:\n    A: 11\n    B: 17\n    C: 19\n    D: 21\n    E: 25\n  correct_option: D\nsolution:\n  reasoning: >\n    First, we complete the square for the equation of the circle:\n    $$ (x^2 - 4x) + (y^2 - 2y) + 1 = 0 $$\n    $$ (x-2)^2 - 4 + (y-1)^2 - 1 + 1 = 0 $$\n    $$ (x-2)^2 + (y-1)^2 = 4 $$\n    This represents a circle with centre $C(2, 1)$ and radius $r = 2$.\n\n    Let $k = 4x + 3y$. This equation represents a family of parallel lines with gradient $-\\frac{4}{3}$. The maximum value of $k$ corresponds to the line in this family that is tangent to the circle such that the value is maximised.\n\n    For the line $4x + 3y - k = 0$ to be tangent to the circle, the perpendicular distance from the centre $(2, 1)$ to the line must equal the radius $r=2$.\n    Using the point-to-line distance formula:\n    $$ \\frac{|4(2) + 3(1) - k|}{\\sqrt{4^2 + 3^2}} = 2 $$\n    $$ \\frac{|11 - k|}{5} = 2 $$\n    $$ |11 - k| = 10 $$\n    \n    This yields two possible values for $k$:\n    $$ 11 - k = 10 \\implies k = 1 $$\n    $$ 11 - k = -10 \\implies k = 21 $$\n    \n    The maximum value is $21$.\n    Hence the correct answer is 21.\n  key_insight: >\n    The maximum value of a linear expression $ax+by$ on a circle occurs when the line $ax+by=k$ is tangent to the circle, meaning the perpendicular distance from the centre to the line equals the radius.\n  distractor_map:\n    A: Evaluates the expression at the centre of the circle $(2, 1)$, ignoring the radius.\n    B: Evaluates the expression at the point on the circle with the maximum $y$-coordinate, $(2, 3)$.\n    C: Evaluates the expression at the point on the circle with the maximum $x$-coordinate, $(4, 1)$.\n    D: Correct answer.\n    E: Incorrectly assumes the maximum occurs at the intersection of the maximum possible $x$ ($x=4$) and maximum possible $y$ ($y=3$).\n```"}, "verifier_report": {"verdict": "PASS", "confidence": "high", "notes": ["The solution is mathematically correct and the answer (21) is unique.", "The problem uses a standard Pythagorean triple (3-4-5) which makes it solvable without a calculator in under 2 minutes.", "The distractors are excellent, covering common misconceptions like evaluating at the center, maximizing variables independently, or maximizing one variable while fixing the other.", "The difficulty is perfectly calibrated for ESAT/ENGAA."], "_raw_text": "verdict: PASS\nconfidence: high\nnotes:\n  - The solution is mathematically correct and the answer (21) is unique.\n  - The problem uses a standard Pythagorean triple (3-4-5) which makes it solvable without a calculator in under 2 minutes.\n  - The distractors are excellent, covering common misconceptions like evaluating at the center, maximizing variables independently, or maximizing one variable while fixing the other.\n  - The difficulty is perfectly calibrated for ESAT/ENGAA."}, "style_report": {"verdict": "PASS", "scores": {"authenticity": 10, "one_idea_purity": 10, "no_calculator": 10, "elegance": 9, "distractor_realism": 10, "plausibility": 10}, "summary": "This question is an excellent example of an ESAT/ENGAA-style problem. It tests a core mathematical concept (optimization on a constraint) with clean numbers, elegant solution path, and highly realistic distractors, all suitable for a no-calculator, time-pressured environment.", "_raw_text": "verdict: PASS\nscores:\n  authenticity: 10\n  one_idea_purity: 10\n  no_calculator: 10\n  elegance: 9\n  distractor_realism: 10\n  plausibility: 10\nsummary: >\n  This question is an excellent example of an ESAT/ENGAA-style problem. It tests a core mathematical concept (optimization on a constraint) with clean numbers, elegant solution path, and highly realistic distractors, all suitable for a no-calculator, time-pressured environment."}, "models": {"designer": "gemini-3-pro-preview", "implementer": "gemini-3-pro-preview", "verifier": "gemini-3-pro-preview", "style_judge": "gemini-2.5-flash"}, "attempts": 1, "created_at": "2025-12-19T01:16:21.469205", "token_usage": {"prompt_tokens": 8794, "candidates_tokens": 1236, "total_tokens": 18705}}
