{"id": "M6-Hard-016a669521", "schema_id": "M6", "difficulty": "Hard", "idea_plan": {"schema_id": "M6", "idea_summary": "The candidate is asked to evaluate a summation of a seemingly complex function over a large set of regularly spaced arguments. The key insight is that the function possesses a rotational symmetry about a specific point, meaning pairs of terms from the start and end of the sequence sum to a constant value, reducing the problem to counting pairs.\n", "function_or_object_type": ["rational", "exponential"], "constraints_used": ["symmetry condition"], "what_is_asked": ["determine a maximum or minimum (value of the sum)"], "intended_wrong_paths": ["Attempting to evaluate the function at the first few points and looking for a simple arithmetic progression.", "Miscounting the number of terms (off-by-one error), leading to an incorrect multiplier for the pairs.", "Failing to handle the middle term correctly if the number of terms is odd (or assuming a middle term exists if even).", "Assuming the function is odd (sums to zero) rather than symmetric about a non-zero vertical level."], "difficulty_rationale": "The difficulty lies in the fact that the symmetry property is not stated; the candidate must look at the messy function, realize direct calculation is impossible, and hypothesize that $f(x) + f(k-x) = \\text{constant}$ to proceed.\n", "mcq_viability": {"viable": true, "reason": "Errors in counting the number of terms or handling the \"middle\" term naturally result in answers that differ by exactly 0.5 or 1 times the constant, creating tight, plausible distractors."}, "_raw_text": "```yaml\nschema_id: M6\nidea_summary: >\n  The candidate is asked to evaluate a summation of a seemingly complex function over a large set of regularly spaced arguments. The key insight is that the function possesses a rotational symmetry about a specific point, meaning pairs of terms from the start and end of the sequence sum to a constant value, reducing the problem to counting pairs.\nfunction_or_object_type:\n  - rational\n  - exponential\nconstraints_used:\n  - symmetry condition\nwhat_is_asked:\n  - determine a maximum or minimum (value of the sum)\nintended_wrong_paths:\n  - Attempting to evaluate the function at the first few points and looking for a simple arithmetic progression.\n  - Miscounting the number of terms (off-by-one error), leading to an incorrect multiplier for the pairs.\n  - Failing to handle the middle term correctly if the number of terms is odd (or assuming a middle term exists if even).\n  - Assuming the function is odd (sums to zero) rather than symmetric about a non-zero vertical level.\ndifficulty_rationale: >\n  The difficulty lies in the fact that the symmetry property is not stated; the candidate must look at the messy function, realize direct calculation is impossible, and hypothesize that $f(x) + f(k-x) = \\text{constant}$ to proceed.\nmcq_viability:\n  viable: yes\n  reason: >\n    Errors in counting the number of terms or handling the \"middle\" term naturally result in answers that differ by exactly 0.5 or 1 times the constant, creating tight, plausible distractors.\n```"}, "question_package": {"question": {"stem": "The function$f$is defined by$$f(x) = \\frac{4^x}{4^x + 2}$$What is the value of the sum$$S = \\sum_{r=1}^{99} f\\left(\\frac{r}{100}\\right)$$", "options": {"A": "49", "B": "49.5", "C": "50", "D": "50.5", "E": "99", "F": "100"}, "correct_option": "B"}, "solution": {"reasoning": "We consider the sum of the function evaluated at$x$and$1-x$:$$f(x) + f(1-x) = \\frac{4^x}{4^x + 2} + \\frac{4^{1-x}}{4^{1-x} + 2}$$Multiplying the numerator and denominator of the second term by$4^x$:$$\\frac{4^{1-x}}{4^{1-x} + 2} = \\frac{4^{1-x} \\cdot 4^x}{(4^{1-x} + 2) \\cdot 4^x} = \\frac{4}{4 + 2 \\cdot 4^x}$$Dividing the numerator and denominator of this new fraction by 2:$$\\frac{2}{2 + 4^x}$$Thus:$$f(x) + f(1-x) = \\frac{4^x}{4^x + 2} + \\frac{2}{4^x + 2} = \\frac{4^x + 2}{4^x + 2} = 1$$The sum consists of terms$f\\left(\\frac{r}{100}\\right)$for$r = 1, 2, \\dots, 99$. We can pair terms symmetrically using the property derived above:$$f\\left(\\frac{r}{100}\\right) + f\\left(\\frac{100-r}{100}\\right) = f\\left(\\frac{r}{100}\\right) + f\\left(1 - \\frac{r}{100}\\right) = 1$$The terms run from$r=1$to$r=99$. The pairs are$(1, 99), (2, 98), \\dots, (49, 51)$. There are 49 such pairs, contributing$49 \\times 1 = 49$to the sum. The remaining middle term is at$r=50$:$$f\\left(\\frac{50}{100}\\right) = f\\left(\\frac{1}{2}\\right) = \\frac{4^{1/2}}{4^{1/2} + 2} = \\frac{2}{2+2} = \\frac{1}{2}$$The total sum is$49 + 0.5 = 49.5$.\nHence the correct answer is 49.5.\n", "key_insight": "Recognising that$f(x) + f(1-x) = \\text{constant}$allows the summation to be evaluated by counting pairs rather than calculating individual terms.\n", "distractor_map": {"A": "Neglects the middle term ($r=50$), summing only the 49 pairs.", "B": "Correct answer.", "C": "Incorrectly rounds the middle term to 1 or assumes $N/2$ logic without checking boundaries.", "D": "Incorrectly includes boundary terms (e.g. $r=0$ and $r=100$) or miscounts pairs.", "E": "Assumes the sum equals the number of terms ($N$).", "F": "Assumes the sum equals the denominator ($N+1$)."}}, "_raw_text": "question:\n  stem: >\n    The function $f$ is defined by\n    $$ f(x) = \\frac{4^x}{4^x + 2} $$\n    What is the value of the sum\n    $$ S = \\sum_{r=1}^{99} f\\left(\\frac{r}{100}\\right) $$\n  options:\n    A: 49\n    B: 49.5\n    C: 50\n    D: 50.5\n    E: 99\n    F: 100\n  correct_option: B\nsolution:\n  reasoning: >\n    We consider the sum of the function evaluated at $x$ and $1-x$:\n    $$ f(x) + f(1-x) = \\frac{4^x}{4^x + 2} + \\frac{4^{1-x}}{4^{1-x} + 2} $$\n    Multiplying the numerator and denominator of the second term by $4^x$:\n    $$ \\frac{4^{1-x}}{4^{1-x} + 2} = \\frac{4^{1-x} \\cdot 4^x}{(4^{1-x} + 2) \\cdot 4^x} = \\frac{4}{4 + 2 \\cdot 4^x} $$\n    Dividing the numerator and denominator of this new fraction by 2:\n    $$ \\frac{2}{2 + 4^x} $$\n    Thus:\n    $$ f(x) + f(1-x) = \\frac{4^x}{4^x + 2} + \\frac{2}{4^x + 2} = \\frac{4^x + 2}{4^x + 2} = 1 $$\n    The sum consists of terms $f\\left(\\frac{r}{100}\\right)$ for $r = 1, 2, \\dots, 99$. We can pair terms symmetrically using the property derived above:\n    $$ f\\left(\\frac{r}{100}\\right) + f\\left(\\frac{100-r}{100}\\right) = f\\left(\\frac{r}{100}\\right) + f\\left(1 - \\frac{r}{100}\\right) = 1 $$\n    The terms run from $r=1$ to $r=99$. The pairs are $(1, 99), (2, 98), \\dots, (49, 51)$.\n    There are 49 such pairs, contributing $49 \\times 1 = 49$ to the sum.\n    The remaining middle term is at $r=50$:\n    $$ f\\left(\\frac{50}{100}\\right) = f\\left(\\frac{1}{2}\\right) = \\frac{4^{1/2}}{4^{1/2} + 2} = \\frac{2}{2+2} = \\frac{1}{2} $$\n    The total sum is $49 + 0.5 = 49.5$.\n    \n    Hence the correct answer is 49.5.\n  key_insight: >\n    Recognising that $f(x) + f(1-x) = \\text{constant}$ allows the summation to be evaluated by counting pairs rather than calculating individual terms.\n  distractor_map:\n    A: Neglects the middle term ($r=50$), summing only the 49 pairs.\n    B: Correct answer.\n    C: Incorrectly rounds the middle term to 1 or assumes $N/2$ logic without checking boundaries.\n    D: Incorrectly includes boundary terms (e.g. $r=0$ and $r=100$) or miscounts pairs.\n    E: Assumes the sum equals the number of terms ($N$).\n    F: Assumes the sum equals the denominator ($N+1$)."}, "verifier_report": {"verdict": "PASS", "confidence": "high", "notes": ["The mathematical derivation is correct; the symmetry $f(x) + f(1-x) = 1$ holds and the summation logic is sound.", "The answer (49.5) is unique and matches Option B.", {"The difficulty is appropriate for ESAT/ENGAA": "it rewards insight (spotting the symmetry) over brute force, fitting the time constraints."}, "Distractors are well-chosen, covering common off-by-one errors and boundary mistakes."], "_raw_text": "verdict: PASS\nconfidence: high\nnotes:\n  - The mathematical derivation is correct; the symmetry $f(x) + f(1-x) = 1$ holds and the summation logic is sound.\n  - The answer (49.5) is unique and matches Option B.\n  - The difficulty is appropriate for ESAT/ENGAA: it rewards insight (spotting the symmetry) over brute force, fitting the time constraints.\n  - Distractors are well-chosen, covering common off-by-one errors and boundary mistakes."}, "style_report": {"verdict": "PASS", "scores": {"authenticity": 9, "one_idea_purity": 10, "no_calculator": 10, "elegance": 10, "distractor_realism": 9, "plausibility": 10}, "summary": "This question is an excellent example of an ESAT/ENGAA-style problem, requiring a key insight into function symmetry to efficiently solve a summation problem. The arithmetic is clean, the distractors are well-chosen, and the overall structure is highly authentic.", "_raw_text": "```yaml\nverdict: PASS\nscores:\n  authenticity: 9\n  one_idea_purity: 10\n  no_calculator: 10\n  elegance: 10\n  distractor_realism: 9\n  plausibility: 10\nsummary: >\n  This question is an excellent example of an ESAT/ENGAA-style problem, requiring a key insight into function symmetry to efficiently solve a summation problem. The arithmetic is clean, the distractors are well-chosen, and the overall structure is highly authentic.\n```"}, "models": {"designer": "gemini-3-pro-preview", "implementer": "gemini-3-pro-preview", "verifier": "gemini-3-pro-preview", "style_judge": "gemini-2.5-flash"}, "attempts": 1, "created_at": "2025-12-19T02:15:20.048020", "token_usage": {"prompt_tokens": 9707, "candidates_tokens": 1496, "total_tokens": 23136}}
