{"id": "M2-Easy-178eb7f820", "schema_id": "M2", "difficulty": "Easy", "idea_plan": {"schema_id": "M2", "idea_summary": "The candidate is given the sum of two variables and the sum of their reciprocals as specific values. They must find the product of the two variables by recognizing the algebraic relationship between the sum of reciprocals and the sum of the variables, rather than solving for the individual variables.\n", "function_or_object_type": ["rational", "system of equations"], "constraints_used": ["value at a point (sum of variables)", "value at a point (sum of reciprocals)"], "what_is_asked": ["determine a value (the product of the variables)"], "intended_wrong_paths": ["attempting to solve for the individual variables via substitution, leading to a messy quadratic equation and potential arithmetic errors", "assuming the sum of reciprocals equals the reciprocal of the sum", "correctly identifying the fraction but failing to invert the final result to find the product"], "difficulty_rationale": "This is an \"Easy\" difficulty task because the algebraic manipulation required is standard at this level. The differentiator is speed: recognizing the identity allows for an instant solution, whereas solving for the variables is computationally inefficient.\n", "mcq_viability": {"viable": true, "reason": "The misconception that 1/x + 1/y = 1/(x+y) produces a very plausible distractor, as does the reciprocal of the correct answer."}, "_raw_text": "```yaml\nschema_id: M2\nidea_summary: >\n  The candidate is given the sum of two variables and the sum of their reciprocals as specific values. They must find the product of the two variables by recognizing the algebraic relationship between the sum of reciprocals and the sum of the variables, rather than solving for the individual variables.\nfunction_or_object_type:\n  - rational\n  - system of equations\nconstraints_used:\n  - value at a point (sum of variables)\n  - value at a point (sum of reciprocals)\nwhat_is_asked:\n  - determine a value (the product of the variables)\nintended_wrong_paths:\n  - attempting to solve for the individual variables via substitution, leading to a messy quadratic equation and potential arithmetic errors\n  - assuming the sum of reciprocals equals the reciprocal of the sum\n  - correctly identifying the fraction but failing to invert the final result to find the product\ndifficulty_rationale: >\n  This is an \"Easy\" difficulty task because the algebraic manipulation required is standard at this level. The differentiator is speed: recognizing the identity allows for an instant solution, whereas solving for the variables is computationally inefficient.\nmcq_viability:\n  viable: yes\n  reason: >\n    The misconception that 1/x + 1/y = 1/(x+y) produces a very plausible distractor, as does the reciprocal of the correct answer.\n```"}, "question_package": {"question": {"stem": "Two non-zero real numbers$x$and$y$satisfy$$x + y = 8$$$$\\frac{1}{x} + \\frac{1}{y} = 6$$What is the value of the product$xy$?\n", "options": {"A": "$\\frac{1}{6}$", "B": "$\\frac{3}{4}$", "C": "$\\frac{4}{3}$", "D": "$6$", "E": "$48$"}, "correct_option": "C"}, "solution": {"reasoning": "We start by combining the terms in the second equation over a common denominator:$$\\frac{1}{x} + \\frac{1}{y} = \\frac{y + x}{xy}$$Substituting the given values ($x+y=8$and$\\frac{1}{x} + \\frac{1}{y} = 6$) into this identity gives:$$6 = \\frac{8}{xy}$$Rearranging to solve for$xy$:$$xy = \\frac{8}{6}$$$$xy = \\frac{4}{3}$$Hence the correct answer is$\\frac{4}{3}$.\n", "key_insight": "Recognising the identity$\\frac{1}{x} + \\frac{1}{y} \\equiv \\frac{x+y}{xy}$allows you to find the product directly from the sums without solving for$x$and$y$.\n"}, "distractor_map": {"A": "Assumes the product is the reciprocal of the sum of reciprocals ($1/6$).", "B": "Incorrect rearrangement of $6 = 8/xy$ (calculating $6/8$ instead of $8/6$).", "C": "Correct answer.", "D": "The value of the sum of reciprocals, mistakenly taken as the answer.", "E": "Multiplies the two given values ($8 \\times 6$) rather than dividing."}, "_raw_text": "```yaml\nquestion:\n  stem: >\n    Two non-zero real numbers $x$ and $y$ satisfy\n    $$ x + y = 8 $$\n    $$ \\frac{1}{x} + \\frac{1}{y} = 6 $$\n    What is the value of the product $xy$?\n  options:\n    A: $\\frac{1}{6}$\n    B: $\\frac{3}{4}$\n    C: $\\frac{4}{3}$\n    D: $6$\n    E: $48$\n  correct_option: C\nsolution:\n  reasoning: >\n    We start by combining the terms in the second equation over a common denominator:\n    $$ \\frac{1}{x} + \\frac{1}{y} = \\frac{y + x}{xy} $$\n    Substituting the given values ($x+y=8$ and $\\frac{1}{x} + \\frac{1}{y} = 6$) into this identity gives:\n    $$ 6 = \\frac{8}{xy} $$\n    Rearranging to solve for $xy$:\n    $$ xy = \\frac{8}{6} $$\n    $$ xy = \\frac{4}{3} $$\n    Hence the correct answer is $\\frac{4}{3}$.\n  key_insight: >\n    Recognising the identity $\\frac{1}{x} + \\frac{1}{y} \\equiv \\frac{x+y}{xy}$ allows you to find the product directly from the sums without solving for $x$ and $y$.\ndistractor_map:\n  A: Assumes the product is the reciprocal of the sum of reciprocals ($1/6$).\n  B: Incorrect rearrangement of $6 = 8/xy$ (calculating $6/8$ instead of $8/6$).\n  C: Correct answer.\n  D: The value of the sum of reciprocals, mistakenly taken as the answer.\n  E: Multiplies the two given values ($8 \\times 6$) rather than dividing.\n```"}, "verifier_report": {"verdict": "PASS", "confidence": "high", "notes": ["The mathematical derivation is correct and the solution is unique.", "I verified that real solutions for $x$ and $y$ actually exist (discriminant of the resulting quadratic $t^2 - 8t + 4/3 = 0$ is positive), making the stem's claim of \"real numbers\" valid.", "The difficulty is appropriate for an early question in the Mathematics 1 section (rapid algebraic manipulation).", "Distractors cover common rearrangement errors (reciprocal) and operation errors."], "_raw_text": "verdict: PASS\nconfidence: high\nnotes:\n  - The mathematical derivation is correct and the solution is unique.\n  - I verified that real solutions for $x$ and $y$ actually exist (discriminant of the resulting quadratic $t^2 - 8t + 4/3 = 0$ is positive), making the stem's claim of \"real numbers\" valid.\n  - The difficulty is appropriate for an early question in the Mathematics 1 section (rapid algebraic manipulation).\n  - Distractors cover common rearrangement errors (reciprocal) and operation errors."}, "style_report": {"verdict": "PASS", "scores": {"authenticity": 10, "one_idea_purity": 10, "no_calculator": 10, "elegance": 10, "distractor_realism": 10, "plausibility": 10}, "summary": "This question is a perfect fit for an ESAT/ENGAA paper, demonstrating excellent authenticity, elegance, and well-crafted distractors that target common algebraic errors. It is concise, requires no calculator, and tests a single, clear mathematical insight.", "_raw_text": "verdict: PASS\nscores:\n  authenticity: 10\n  one_idea_purity: 10\n  no_calculator: 10\n  elegance: 10\n  distractor_realism: 10\n  plausibility: 10\nsummary: >\n  This question is a perfect fit for an ESAT/ENGAA paper, demonstrating excellent authenticity, elegance, and well-crafted distractors that target common algebraic errors. It is concise, requires no calculator, and tests a single, clear mathematical insight."}, "models": {"designer": "gemini-3-pro-preview", "implementer": "gemini-3-pro-preview", "verifier": "gemini-3-pro-preview", "style_judge": "gemini-2.5-flash"}, "attempts": 1, "created_at": "2025-12-19T01:17:56.754356", "token_usage": {"prompt_tokens": 7778, "candidates_tokens": 1007, "total_tokens": 18674}}
