{"id": "M7-Hard-057ce9a066", "schema_id": "M7", "difficulty": "Hard", "idea_plan": {"schema_id": "M7", "idea_summary": "The student must determine the maximum value of a linear expression involving two variables, subject to a constraint equation that describes a circle offset from the origin. The efficient path requires interpreting the linear expression as a family of parallel lines and identifying the specific line that is tangent to the circle, using the perpendicular distance from the circle's center rather than calculus or algebraic substitution.\n", "function_or_object_type": ["geometric (circle equation)", "linear expression"], "constraints_used": ["value at a point (center of circle)", "geometric tangency (distance from point to line)"], "what_is_asked": ["determine a maximum or minimum"], "intended_wrong_paths": ["substituting the coordinates of the circle's center directly into the linear expression, ignoring the radius.", "assuming the maximum occurs at the geometric top or rightmost point of the circle (coordinate extremes) rather than the tangent point.", "attempting to substitute the linear relationship into the quadratic constraint and solving for the discriminant, leading to algebraic overwhelm."], "difficulty_rationale": "While solvable via the discriminant method, the algebra is deliberately designed to be cumbersome without a calculator. The question filters for candidates who can switch from an algebraic view to a geometric one (distance from center to line) to solve it in seconds.\n", "mcq_viability": {"viable": true, "reason": "The wrong paths (center substitution, coordinate extremes) yield clean, plausible integer or simple surd answers that function as strong distractors."}, "_raw_text": "```yaml\nschema_id: M7\nidea_summary: >\n  The student must determine the maximum value of a linear expression involving two variables, subject to a constraint equation that describes a circle offset from the origin. The efficient path requires interpreting the linear expression as a family of parallel lines and identifying the specific line that is tangent to the circle, using the perpendicular distance from the circle's center rather than calculus or algebraic substitution.\nfunction_or_object_type:\n  - geometric (circle equation)\n  - linear expression\nconstraints_used:\n  - value at a point (center of circle)\n  - geometric tangency (distance from point to line)\nwhat_is_asked:\n  - determine a maximum or minimum\nintended_wrong_paths:\n  - substituting the coordinates of the circle's center directly into the linear expression, ignoring the radius.\n  - assuming the maximum occurs at the geometric top or rightmost point of the circle (coordinate extremes) rather than the tangent point.\n  - attempting to substitute the linear relationship into the quadratic constraint and solving for the discriminant, leading to algebraic overwhelm.\ndifficulty_rationale: >\n  While solvable via the discriminant method, the algebra is deliberately designed to be cumbersome without a calculator. The question filters for candidates who can switch from an algebraic view to a geometric one (distance from center to line) to solve it in seconds.\nmcq_viability:\n  viable: yes\n  reason: >\n    The wrong paths (center substitution, coordinate extremes) yield clean, plausible integer or simple surd answers that function as strong distractors.\n```"}, "question_package": {"question": {"stem": "The real variables$x$and$y$satisfy the equation$$x^2 + y^2 - 4x - 6y + 9 = 0$$What is the maximum possible value of$4x + 3y$?\n", "options": {"A": "17", "B": "23", "C": "25", "D": "27", "E": "31"}, "correct_option": "D"}, "solution": {"reasoning": "First, we determine the geometric properties of the constraint by completing the square for both$x$and$y$:$$(x^2 - 4x) + (y^2 - 6y) + 9 = 0$$$$(x-2)^2 - 4 + (y-3)^2 - 9 + 9 = 0$$$$(x-2)^2 + (y-3)^2 = 4$$This represents a circle with centre$C(2, 3)$and radius$r = 2$.\n\nLet$k = 4x + 3y$. This equation describes a family of parallel lines with gradient$-\\frac{4}{3}$. The maximum value of$k$corresponds to the line in this family that is tangent to the circle and farthest from the origin in the positive direction.\n\nFor the line$4x + 3y - k = 0$to be tangent to the circle, the perpendicular distance from the centre$(2, 3)$to the line must equal the radius$r=2$.\nUsing the perpendicular distance formula:$$\\frac{|ax_0 + by_0 + c|}{\\sqrt{a^2 + b^2}} = r$$$$\\frac{|4(2) + 3(3) - k|}{\\sqrt{4^2 + 3^2}} = 2$$$$\\frac{|8 + 9 - k|}{\\sqrt{25}} = 2$$$$\\frac{|17 - k|}{5} = 2$$$$|17 - k| = 10$$This gives two possible values for$k$:$$17 - k = 10 \\implies k = 7 \\quad (\\text{minimum})$$$$17 - k = -10 \\implies k = 27 \\quad (\\text{maximum})$$Hence the correct answer is 27.\n", "key_insight": "To maximize a linear expression$ax+by$subject to a circular constraint, set the perpendicular distance from the circle's centre to the line$ax+by=k$equal to the radius.\n"}, "distractor_map": {"A": "The value of the expression at the circle's centre, $(2, 3)$.", "B": "The value at the highest point of the circle, $(2, 5)$.", "C": "The value at the rightmost point of the circle, $(4, 3)$.", "D": "Correct answer.", "E": "The value at the corner of the bounding box, $(4, 5)$, assuming $x$ and $y$ are maximized independently."}, "_raw_text": "```yaml\nquestion:\n  stem: >\n    The real variables $x$ and $y$ satisfy the equation\n    $$ x^2 + y^2 - 4x - 6y + 9 = 0 $$\n    What is the maximum possible value of $4x + 3y$?\n  options:\n    A: 17\n    B: 23\n    C: 25\n    D: 27\n    E: 31\n  correct_option: D\nsolution:\n  reasoning: >\n    First, we determine the geometric properties of the constraint by completing the square for both $x$ and $y$:\n\n    $$ (x^2 - 4x) + (y^2 - 6y) + 9 = 0 $$\n\n    $$ (x-2)^2 - 4 + (y-3)^2 - 9 + 9 = 0 $$\n\n    $$ (x-2)^2 + (y-3)^2 = 4 $$\n\n    This represents a circle with centre $C(2, 3)$ and radius $r = 2$.\n\n\n    Let $k = 4x + 3y$. This equation describes a family of parallel lines with gradient $-\\frac{4}{3}$. The maximum value of $k$ corresponds to the line in this family that is tangent to the circle and farthest from the origin in the positive direction.\n\n\n    For the line $4x + 3y - k = 0$ to be tangent to the circle, the perpendicular distance from the centre $(2, 3)$ to the line must equal the radius $r=2$.\n\n    Using the perpendicular distance formula:\n\n    $$ \\frac{|ax_0 + by_0 + c|}{\\sqrt{a^2 + b^2}} = r $$\n\n    $$ \\frac{|4(2) + 3(3) - k|}{\\sqrt{4^2 + 3^2}} = 2 $$\n\n    $$ \\frac{|8 + 9 - k|}{\\sqrt{25}} = 2 $$\n\n    $$ \\frac{|17 - k|}{5} = 2 $$\n\n    $$ |17 - k| = 10 $$\n\n\n    This gives two possible values for $k$:\n\n    $$ 17 - k = 10 \\implies k = 7 \\quad (\\text{minimum}) $$\n\n    $$ 17 - k = -10 \\implies k = 27 \\quad (\\text{maximum}) $$\n\n\n    Hence the correct answer is 27.\n  key_insight: >\n    To maximize a linear expression $ax+by$ subject to a circular constraint, set the perpendicular distance from the circle's centre to the line $ax+by=k$ equal to the radius.\ndistractor_map:\n  A: The value of the expression at the circle's centre, $(2, 3)$.\n  B: The value at the highest point of the circle, $(2, 5)$.\n  C: The value at the rightmost point of the circle, $(4, 3)$.\n  D: Correct answer.\n  E: The value at the corner of the bounding box, $(4, 5)$, assuming $x$ and $y$ are maximized independently.\n```"}, "verifier_report": {"verdict": "PASS", "confidence": "high", "notes": ["The solution is mathematically correct and the answer (27) is unique.", "The problem uses clean numbers (Pythagorean triple 3-4-5, integer radius), making it solvable without a calculator in under 2 minutes.", "The distractors are excellent, covering the value at the centre, the independent maxima of x and y (bounding box error), and the individual coordinate maxima.", "The style and difficulty are perfectly aligned with ESAT/ENGAA requirements."], "_raw_text": "verdict: PASS\nconfidence: high\nnotes:\n  - The solution is mathematically correct and the answer (27) is unique.\n  - The problem uses clean numbers (Pythagorean triple 3-4-5, integer radius), making it solvable without a calculator in under 2 minutes.\n  - The distractors are excellent, covering the value at the centre, the independent maxima of x and y (bounding box error), and the individual coordinate maxima.\n  - The style and difficulty are perfectly aligned with ESAT/ENGAA requirements."}, "style_report": {"verdict": "PASS", "scores": {"authenticity": 10, "one_idea_purity": 9, "no_calculator": 10, "elegance": 10, "distractor_realism": 10, "plausibility": 10}, "summary": "This question is a classic problem type for ESAT/ENGAA, combining coordinate geometry and optimization. The numbers are perfectly chosen for a no-calculator environment, and the distractors are exceptionally well-crafted to target common student errors.", "_raw_text": "```yaml\nverdict: PASS\nscores:\n  authenticity: 10\n  one_idea_purity: 9\n  no_calculator: 10\n  elegance: 10\n  distractor_realism: 10\n  plausibility: 10\nsummary: >\n  This question is a classic problem type for ESAT/ENGAA, combining coordinate geometry and optimization. The numbers are perfectly chosen for a no-calculator environment, and the distractors are exceptionally well-crafted to target common student errors.\n```"}, "models": {"designer": "gemini-3-pro-preview", "implementer": "gemini-3-pro-preview", "verifier": "gemini-3-pro-preview", "style_judge": "gemini-2.5-flash"}, "attempts": 1, "created_at": "2025-12-19T01:14:28.979406", "token_usage": {"prompt_tokens": 9102, "candidates_tokens": 1297, "total_tokens": 19259}}
{"id": "M4-Medium-655b77d0a6", "schema_id": "M4", "difficulty": "Medium", "idea_plan": {"schema_id": "M4", "idea_summary": "A straight line passing through a fixed point intersects a simple symmetric curve (such as a parabola) at two distinct points. The candidate must determine the gradient of the line given a specific geometric condition regarding the location of the midpoint of the resulting chord (e.g., its x-coordinate).\n", "function_or_object_type": ["polynomial (quadratic)", "linear"], "constraints_used": ["intersection of functions", "symmetry condition (midpoint logic)"], "what_is_asked": ["identify a parameter (gradient)"], "intended_wrong_paths": ["attempting to calculate the specific coordinates of the intersection points (algebraic deadlock)", "failing to divide the sum of roots by two when determining the midpoint", "confusing the sum of roots with the product of roots", "assuming the midpoint lies on the curve rather than just satisfying a coordinate constraint"], "difficulty_rationale": "The problem is computationally heavy if the candidate attempts to solve for the roots explicitly. It becomes a quick \"Medium\" difficulty task only if the candidate recognizes that the geometric midpoint corresponds to the algebraic average of the roots (Vieta's formulas).\n", "mcq_viability": {"viable": true, "reason": "Common algebraic slips (sign errors in sum of roots, missing factor of 2) generate clean, distinct integer or simple fraction distractors."}, "_raw_text": "```yaml\nschema_id: M4\nidea_summary: >\n  A straight line passing through a fixed point intersects a simple symmetric curve (such as a parabola) at two distinct points. The candidate must determine the gradient of the line given a specific geometric condition regarding the location of the midpoint of the resulting chord (e.g., its x-coordinate).\nfunction_or_object_type:\n  - polynomial (quadratic)\n  - linear\nconstraints_used:\n  - intersection of functions\n  - symmetry condition (midpoint logic)\nwhat_is_asked:\n  - identify a parameter (gradient)\nintended_wrong_paths:\n  - attempting to calculate the specific coordinates of the intersection points (algebraic deadlock)\n  - failing to divide the sum of roots by two when determining the midpoint\n  - confusing the sum of roots with the product of roots\n  - assuming the midpoint lies on the curve rather than just satisfying a coordinate constraint\ndifficulty_rationale: >\n  The problem is computationally heavy if the candidate attempts to solve for the roots explicitly. It becomes a quick \"Medium\" difficulty task only if the candidate recognizes that the geometric midpoint corresponds to the algebraic average of the roots (Vieta's formulas).\nmcq_viability:\n  viable: yes\n  reason: >\n    Common algebraic slips (sign errors in sum of roots, missing factor of 2) generate clean, distinct integer or simple fraction distractors.\n```"}, "question_package": {"question": {"stem": "A straight line with gradient$m$passes through the point$(-1, 0)$. The line intersects the curve$y = 2x^2 + 3x$at two distinct points. The$x$-coordinate of the midpoint of the chord connecting these points is$1$.\nWhat is the value of$m$?\n", "options": {"A": "-7", "B": "-1", "C": "4", "D": "5", "E": "7"}, "correct_option": "E"}, "solution": {"reasoning": "The equation of the line passing through$(-1, 0)$with gradient$m$is:$$y - 0 = m(x - (-1)) \\implies y = mx + m$$To find the points of intersection, we equate the line and the curve:$$2x^2 + 3x = mx + m$$$$2x^2 + (3 - m)x - m = 0$$Let the$x$-coordinates of the intersection points be$\\alpha$and$\\beta$. The$x$-coordinate of the midpoint is given by$\\frac{\\alpha + \\beta}{2}$. Using the relationship between roots and coefficients (Vieta's formulas), the sum of the roots is:$$\\alpha + \\beta = -\\frac{b}{a} = -\\frac{3 - m}{2} = \\frac{m - 3}{2}$$Therefore, the midpoint$x$-coordinate is:$$\\frac{\\alpha + \\beta}{2} = \\frac{m - 3}{4}$$We are given that the midpoint is at$x = 1$:$$\\frac{m - 3}{4} = 1$$$$m - 3 = 4$$$$m = 7$$Hence the correct answer is 7.\n", "key_insight": "For any parabola$y=ax^2+bx+c$, the gradient of a chord is equal to the gradient of the tangent at the chord's specific midpoint$x$-coordinate ($m = 2ax_{mid} + b$).\n", "distractor_map": {"A": "Sign error when grouping the $x$ terms (using $3+m$ instead of $3-m$), leading to $-(3+m)/4 = 1 \\implies m = -7$.", "B": "Sign error in the sum of roots formula (using $b/a$ instead of $-b/a$), leading to $(3-m)/4 = 1 \\implies m = -1$.", "C": "Failing to account for the coefficient of $x^2$ ($a=2$) and the midpoint division, solving $m-3 = 1 \\implies m=4$.", "D": "Failing to divide the sum of roots by 2 to find the midpoint, solving $(m-3)/2 = 1 \\implies m=5$.", "E": "Correct answer."}}, "_raw_text": "```yaml\nquestion:\n  stem: >\n    A straight line with gradient $m$ passes through the point $(-1, 0)$.\n    The line intersects the curve $y = 2x^2 + 3x$ at two distinct points.\n    The $x$-coordinate of the midpoint of the chord connecting these points is $1$.\n\n    What is the value of $m$?\n  options:\n    A: -7\n    B: -1\n    C: 4\n    D: 5\n    E: 7\n  correct_option: E\nsolution:\n  reasoning: >\n    The equation of the line passing through $(-1, 0)$ with gradient $m$ is:\n    $$ y - 0 = m(x - (-1)) \\implies y = mx + m $$\n\n    To find the points of intersection, we equate the line and the curve:\n    $$ 2x^2 + 3x = mx + m $$\n    $$ 2x^2 + (3 - m)x - m = 0 $$\n\n    Let the $x$-coordinates of the intersection points be $\\alpha$ and $\\beta$.\n    The $x$-coordinate of the midpoint is given by $\\frac{\\alpha + \\beta}{2}$.\n    Using the relationship between roots and coefficients (Vieta's formulas), the sum of the roots is:\n    $$ \\alpha + \\beta = -\\frac{b}{a} = -\\frac{3 - m}{2} = \\frac{m - 3}{2} $$\n\n    Therefore, the midpoint $x$-coordinate is:\n    $$ \\frac{\\alpha + \\beta}{2} = \\frac{m - 3}{4} $$\n\n    We are given that the midpoint is at $x = 1$:\n    $$ \\frac{m - 3}{4} = 1 $$\n    $$ m - 3 = 4 $$\n    $$ m = 7 $$\n\n    Hence the correct answer is 7.\n  key_insight: >\n    For any parabola $y=ax^2+bx+c$, the gradient of a chord is equal to the gradient of the tangent at the chord's specific midpoint $x$-coordinate ($m = 2ax_{mid} + b$).\n  distractor_map:\n    A: Sign error when grouping the $x$ terms (using $3+m$ instead of $3-m$), leading to $-(3+m)/4 = 1 \\implies m = -7$.\n    B: Sign error in the sum of roots formula (using $b/a$ instead of $-b/a$), leading to $(3-m)/4 = 1 \\implies m = -1$.\n    C: Failing to account for the coefficient of $x^2$ ($a=2$) and the midpoint division, solving $m-3 = 1 \\implies m=4$.\n    D: Failing to divide the sum of roots by 2 to find the midpoint, solving $(m-3)/2 = 1 \\implies m=5$.\n    E: Correct answer.\n```"}, "verifier_report": {"verdict": "PASS", "confidence": "high", "notes": ["The solution is mathematically correct and the answer (7) is unique.", "The problem is well-suited for ESAT/ENGAA, solvable via standard coordinate geometry (algebra) or a quick calculus insight ($m_{chord} = f'(x_{mid})$).", "The difficulty level is appropriate (under 4 minutes).", "Distractors correspond to plausible algebraic errors (sign errors, missing coefficients)."], "_raw_text": "verdict: PASS\nconfidence: high\nnotes:\n  - The solution is mathematically correct and the answer (7) is unique.\n  - The problem is well-suited for ESAT/ENGAA, solvable via standard coordinate geometry (algebra) or a quick calculus insight ($m_{chord} = f'(x_{mid})$).\n  - The difficulty level is appropriate (under 4 minutes).\n  - Distractors correspond to plausible algebraic errors (sign errors, missing coefficients)."}, "style_report": {"verdict": "PASS", "scores": {"authenticity": 9, "one_idea_purity": 9, "no_calculator": 10, "elegance": 9, "distractor_realism": 10, "plausibility": 10}, "summary": "This question is a well-crafted problem testing fundamental algebraic skills related to quadratic equations and coordinate geometry, with highly realistic distractors. It is perfectly suited for an ESAT/ENGAA paper.", "_raw_text": "```yaml\nverdict: PASS\nscores:\n  authenticity: 9\n  one_idea_purity: 9\n  no_calculator: 10\n  elegance: 9\n  distractor_realism: 10\n  plausibility: 10\nsummary: >\n  This question is a well-crafted problem testing fundamental algebraic skills related to quadratic equations and coordinate geometry, with highly realistic distractors. It is perfectly suited for an ESAT/ENGAA paper.\n```"}, "models": {"designer": "gemini-3-pro-preview", "implementer": "gemini-3-pro-preview", "verifier": "gemini-3-pro-preview", "style_judge": "gemini-2.5-flash"}, "attempts": 2, "created_at": "2025-12-19T01:15:51.685264", "token_usage": {"prompt_tokens": 11662, "candidates_tokens": 1905, "total_tokens": 29843}}
