{"id": "M7-Medium-56ef5ae832", "schema_id": "M7", "difficulty": "Medium", "idea_plan": {"schema_id": "M7", "idea_summary": "Maximize a linear function of two variables subject to a constraint equation representing a circle centered at the origin. The candidate must recognize that the level sets of the objective function are parallel lines and the maximum value corresponds to the line tangent to the circle, solvable via the perpendicular distance formula rather than calculus.\n", "function_or_object_type": ["polynomial (linear expression)", "geometric (circle equation)"], "constraints_used": ["value at a point (tangency condition)", "inequality / bound (implicit in maximization)"], "what_is_asked": ["determine a maximum or minimum"], "intended_wrong_paths": ["maximising each variable independently (setting both to the radius)", "assuming the maximum occurs where the variables are equal (incorrect symmetry assumption)", "attempting algebraic substitution and failing to resolve the resulting radical expression correctly"], "difficulty_rationale": "Requires bridging algebra and geometry. While solvable via calculus (Lagrange multipliers or implicit differentiation), that path is computationally heavy and prone to error without a calculator. The geometric insight (distance from origin to line) makes it a one-step solution.\n", "mcq_viability": {"viable": true, "reason": "The incorrect assumptions (independent maximization vs. symmetric maximization) yield clean, plausible algebraic expressions that differ distinctly from the correct vector-magnitude style answer."}, "_raw_text": "```yaml\nschema_id: M7\nidea_summary: >\n  Maximize a linear function of two variables subject to a constraint equation representing a circle centered at the origin. The candidate must recognize that the level sets of the objective function are parallel lines and the maximum value corresponds to the line tangent to the circle, solvable via the perpendicular distance formula rather than calculus.\nfunction_or_object_type:\n  - polynomial (linear expression)\n  - geometric (circle equation)\nconstraints_used:\n  - value at a point (tangency condition)\n  - inequality / bound (implicit in maximization)\nwhat_is_asked:\n  - determine a maximum or minimum\nintended_wrong_paths:\n  - maximising each variable independently (setting both to the radius)\n  - assuming the maximum occurs where the variables are equal (incorrect symmetry assumption)\n  - attempting algebraic substitution and failing to resolve the resulting radical expression correctly\ndifficulty_rationale: >\n  Requires bridging algebra and geometry. While solvable via calculus (Lagrange multipliers or implicit differentiation), that path is computationally heavy and prone to error without a calculator. The geometric insight (distance from origin to line) makes it a one-step solution.\nmcq_viability:\n  viable: yes\n  reason: >\n    The incorrect assumptions (independent maximization vs. symmetric maximization) yield clean, plausible algebraic expressions that differ distinctly from the correct vector-magnitude style answer.\n```"}, "question_package": {"question": {"stem": "Real numbers$x$and$y$satisfy the equation$x^2 + y^2 = 4$.\nWhat is the maximum possible value of$5x + 12y$?\n", "options": {"A": "13", "B": "24", "C": "$17\\sqrt{2}$", "D": "26", "E": "34"}, "correct_option": "D"}, "solution": {"reasoning": "Let$k = 5x + 12y$. This equation describes a line in the$xy$-plane with a normal vector$\\begin{pmatrix} 5 \\\\ 12 \\end{pmatrix}$.\nWe seek the maximum value of$k$such that the line intersects the circle$x^2 + y^2 = 2^2$. The maximum value corresponds to the line tangent to the circle in the first quadrant.\nFor a tangent line, the perpendicular distance from the origin$(0,0)$to the line$5x + 12y - k = 0$must equal the radius,$r=2$.\nUsing the perpendicular distance formula:$$\\frac{|5(0) + 12(0) - k|}{\\sqrt{5^2 + 12^2}} = 2$$$$\\frac{|-k|}{\\sqrt{25 + 144}} = 2$$$$\\frac{k}{13} = 2 \\implies k = 26$$Hence the correct answer is 26.\n", "key_insight": "The maximum value of a linear function$ax + by$subject to$x^2 + y^2 = r^2$is given by$r\\sqrt{a^2 + b^2}$.\n", "distractor_map": {"A": "The magnitude of the coefficient vector (13), neglecting the radius multiplier.", "B": "The result of maximizing only the term with the largest coefficient ($x=0, y=2 \\implies 24$).", "C": "The result of assuming the maximum occurs at the symmetric point $x=y$ ($x=\\sqrt{2} \\implies 17\\sqrt{2}$).", "D": "Correct answer.", "E": "The result of maximizing $x$ and $y$ independently ($x=2, y=2 \\implies 10+24=34$)."}}, "_raw_text": "```yaml\nquestion:\n  stem: >\n    Real numbers $x$ and $y$ satisfy the equation $x^2 + y^2 = 4$.\n    \n    What is the maximum possible value of $5x + 12y$?\n  options:\n    A: 13\n    B: 24\n    C: $17\\sqrt{2}$\n    D: 26\n    E: 34\n  correct_option: D\nsolution:\n  reasoning: >\n    Let $k = 5x + 12y$. This equation describes a line in the $xy$-plane with a normal vector $\\begin{pmatrix} 5 \\\\ 12 \\end{pmatrix}$.\n    \n    We seek the maximum value of $k$ such that the line intersects the circle $x^2 + y^2 = 2^2$.\n    The maximum value corresponds to the line tangent to the circle in the first quadrant.\n    \n    For a tangent line, the perpendicular distance from the origin $(0,0)$ to the line $5x + 12y - k = 0$ must equal the radius, $r=2$.\n    \n    Using the perpendicular distance formula:\n    \n    $$ \\frac{|5(0) + 12(0) - k|}{\\sqrt{5^2 + 12^2}} = 2 $$\n    \n    $$ \\frac{|-k|}{\\sqrt{25 + 144}} = 2 $$\n    \n    $$ \\frac{k}{13} = 2 \\implies k = 26 $$\n    \n    Hence the correct answer is 26.\n  key_insight: >\n    The maximum value of a linear function $ax + by$ subject to $x^2 + y^2 = r^2$ is given by $r\\sqrt{a^2 + b^2}$.\n  distractor_map:\n    A: The magnitude of the coefficient vector (13), neglecting the radius multiplier.\n    B: The result of maximizing only the term with the largest coefficient ($x=0, y=2 \\implies 24$).\n    C: The result of assuming the maximum occurs at the symmetric point $x=y$ ($x=\\sqrt{2} \\implies 17\\sqrt{2}$).\n    D: Correct answer.\n    E: The result of maximizing $x$ and $y$ independently ($x=2, y=2 \\implies 10+24=34$).\n```"}, "verifier_report": {"verdict": "PASS", "confidence": "high", "notes": ["The solution is mathematically correct and the answer (26) is unique.", "The use of the Pythagorean triple (5, 12, 13) ensures the arithmetic is clean and solvable without a calculator.", "The difficulty is appropriate for ESAT/ENGAA, rewarding geometric insight (distance from origin) or algebraic insight (Cauchy-Schwarz) over brute force.", "Distractors represent distinct, plausible reasoning errors (ignoring radius, greedy approach, symmetry assumption, ignoring constraint)."], "_raw_text": "verdict: PASS\nconfidence: high\nnotes:\n  - The solution is mathematically correct and the answer (26) is unique.\n  - The use of the Pythagorean triple (5, 12, 13) ensures the arithmetic is clean and solvable without a calculator.\n  - The difficulty is appropriate for ESAT/ENGAA, rewarding geometric insight (distance from origin) or algebraic insight (Cauchy-Schwarz) over brute force.\n  - Distractors represent distinct, plausible reasoning errors (ignoring radius, greedy approach, symmetry assumption, ignoring constraint)."}, "style_report": {"verdict": "PASS", "scores": {"authenticity": 10, "one_idea_purity": 10, "no_calculator": 10, "elegance": 10, "distractor_realism": 10, "plausibility": 10}, "summary": "This is a perfectly crafted question for ESAT/ENGAA. It tests a fundamental concept (constrained optimization of a linear function on a circle) with elegant solutions (geometric or Cauchy-Schwarz), uses a classic Pythagorean triple for clean arithmetic, and features highly realistic distractors that target common student errors.", "_raw_text": "verdict: PASS\nscores:\n  authenticity: 10\n  one_idea_purity: 10\n  no_calculator: 10\n  elegance: 10\n  distractor_realism: 10\n  plausibility: 10\nsummary: >\n  This is a perfectly crafted question for ESAT/ENGAA. It tests a fundamental concept (constrained optimization of a linear function on a circle) with elegant solutions (geometric or Cauchy-Schwarz), uses a classic Pythagorean triple for clean arithmetic, and features highly realistic distractors that target common student errors."}, "models": {"designer": "gemini-3-pro-preview", "implementer": "gemini-3-pro-preview", "verifier": "gemini-3-pro-preview", "style_judge": "gemini-2.5-flash"}, "attempts": 1, "created_at": "2025-12-19T02:10:59.513776", "token_usage": {"prompt_tokens": 8251, "candidates_tokens": 1114, "total_tokens": 19671}}
