{"id": "M5-Medium-791e678d4f", "schema_id": "M5", "difficulty": "Medium", "idea_plan": {"schema_id": "M5", "idea_summary": "Determine the minimum value of a function composed of two rational trigonometric terms. The candidate must combine the fractions algebraically to reveal that the expression simplifies via Pythagorean identities to a single scaled reciprocal function (e.g., of the form $k \\sec x$), making the extremum obvious without calculus.\n", "function_or_object_type": ["rational", "trigonometric"], "constraints_used": ["extremum condition", "value at a point"], "what_is_asked": ["determine a maximum or minimum"], "intended_wrong_paths": ["Attempting to differentiate the unsimplified fractions using the quotient rule (time-consuming and error-prone).", "Incorrectly simplifying the algebraic sum (e.g., sign errors in the numerator or failing to use the Pythagorean identity).", "Assuming the minimum occurs at the endpoints or at zero without analysing the combined function.", "Treating the two terms as independent and summing their individual minima."], "difficulty_rationale": "This matches Medium difficulty because the \"brute force\" calculus path is technically possible but computationally punishing, whereas the algebraic insight (common denominator) reduces the problem to a trivial property of a basic function.\n", "mcq_viability": {"viable": true, "reason": "Algebraic errors or incorrect assumptions about the resulting reciprocal function naturally lead to specific integer distractors (e.g., 1, 0, or 4)."}, "_raw_text": "schema_id: M5\nidea_summary: >\n  Determine the minimum value of a function composed of two rational trigonometric terms. The candidate must combine the fractions algebraically to reveal that the expression simplifies via Pythagorean identities to a single scaled reciprocal function (e.g., of the form $k \\sec x$), making the extremum obvious without calculus.\nfunction_or_object_type:\n  - rational\n  - trigonometric\nconstraints_used:\n  - extremum condition\n  - value at a point\nwhat_is_asked:\n  - determine a maximum or minimum\nintended_wrong_paths:\n  - Attempting to differentiate the unsimplified fractions using the quotient rule (time-consuming and error-prone).\n  - Incorrectly simplifying the algebraic sum (e.g., sign errors in the numerator or failing to use the Pythagorean identity).\n  - Assuming the minimum occurs at the endpoints or at zero without analysing the combined function.\n  - Treating the two terms as independent and summing their individual minima.\ndifficulty_rationale: >\n  This matches Medium difficulty because the \"brute force\" calculus path is technically possible but computationally punishing, whereas the algebraic insight (common denominator) reduces the problem to a trivial property of a basic function.\nmcq_viability:\n  viable: yes\n  reason: >\n    Algebraic errors or incorrect assumptions about the resulting reciprocal function naturally lead to specific integer distractors (e.g., 1, 0, or 4)."}, "question_package": {"question": {"stem": "The function$f$is defined for$0 < x < \\pi$by$$f(x) = \\frac{\\sin x}{1-\\cos x} + \\frac{\\sin x}{1+\\cos x}$$What is the minimum value of$f(x)$?\n", "options": {"A": "0", "B": "1", "C": "2", "D": "$2\\sqrt{2}$", "E": "4"}, "correct_option": "C"}, "solution": {"reasoning": "We combine the two terms using a common denominator:$$f(x) = \\frac{\\sin x(1+\\cos x) + \\sin x(1-\\cos x)}{(1-\\cos x)(1+\\cos x)}$$Expanding the numerator and simplifying the denominator:$$f(x) = \\frac{\\sin x + \\sin x \\cos x + \\sin x - \\sin x \\cos x}{1 - \\cos^2 x}$$$$f(x) = \\frac{2\\sin x}{\\sin^2 x}$$Since$\\sin x \\neq 0$for$0 < x < \\pi$, we can cancel a factor of$\\sin x$:$$f(x) = \\frac{2}{\\sin x} = 2 \\csc x$$The minimum value of$\\csc x$on the interval$(0, \\pi)$is$1$(occurring at$x = \\frac{\\pi}{2}$). Therefore, the minimum value of$f(x)$is$2(1) = 2$.\nHence the correct answer is C.\n", "key_insight": "Combining rational trigonometric terms over a common denominator often reveals a single reciprocal function via Pythagorean identities.\n"}, "distractor_map": {"A": "Incorrectly assumes the minimum is the sum of the infimums of the two terms treated independently ($\\cot(x/2) \\to 0$ and $\\tan(x/2) \\to 0$).", "B": "Result of an algebraic error, such as missing the factor of 2 in the numerator (leading to $\\csc x$), or incorrectly summing independent minima (1 + 0).", "C": "Correct.", "D": "The value of the function at $x = \\frac{\\pi}{4}$ ($2\\csc(\\frac{\\pi}{4}) = 2\\sqrt{2}$), assuming the minimum occurs at this standard angle.", "E": "The value of the function at $x = \\frac{\\pi}{6}$ or $x = \\frac{5\\pi}{6}$ ($2(2) = 4$), or result of an arithmetic error."}, "_raw_text": "question:\n  stem: >\n    The function $f$ is defined for $0 < x < \\pi$ by\n    $$ f(x) = \\frac{\\sin x}{1-\\cos x} + \\frac{\\sin x}{1+\\cos x} $$\n    What is the minimum value of $f(x)$?\n  options:\n    A: 0\n    B: 1\n    C: 2\n    D: $2\\sqrt{2}$\n    E: 4\n  correct_option: C\nsolution:\n  reasoning: >\n    We combine the two terms using a common denominator:\n    $$ f(x) = \\frac{\\sin x(1+\\cos x) + \\sin x(1-\\cos x)}{(1-\\cos x)(1+\\cos x)} $$\n    Expanding the numerator and simplifying the denominator:\n    $$ f(x) = \\frac{\\sin x + \\sin x \\cos x + \\sin x - \\sin x \\cos x}{1 - \\cos^2 x} $$\n    $$ f(x) = \\frac{2\\sin x}{\\sin^2 x} $$\n    Since $\\sin x \\neq 0$ for $0 < x < \\pi$, we can cancel a factor of $\\sin x$:\n    $$ f(x) = \\frac{2}{\\sin x} = 2 \\csc x $$\n    The minimum value of $\\csc x$ on the interval $(0, \\pi)$ is $1$ (occurring at $x = \\frac{\\pi}{2}$).\n    Therefore, the minimum value of $f(x)$ is $2(1) = 2$.\n    \n    Hence the correct answer is C.\n  key_insight: >\n    Combining rational trigonometric terms over a common denominator often reveals a single reciprocal function via Pythagorean identities.\ndistractor_map:\n  A: Incorrectly assumes the minimum is the sum of the infimums of the two terms treated independently ($\\cot(x/2) \\to 0$ and $\\tan(x/2) \\to 0$).\n  B: Result of an algebraic error, such as missing the factor of 2 in the numerator (leading to $\\csc x$), or incorrectly summing independent minima (1 + 0).\n  C: Correct.\n  D: The value of the function at $x = \\frac{\\pi}{4}$ ($2\\csc(\\frac{\\pi}{4}) = 2\\sqrt{2}$), assuming the minimum occurs at this standard angle.\n  E: The value of the function at $x = \\frac{\\pi}{6}$ or $x = \\frac{5\\pi}{6}$ ($2(2) = 4$), or result of an arithmetic error."}, "verifier_report": {"verdict": "PASS", "confidence": "high", "notes": ["The mathematical derivation is correct and robust.", "The question can be solved via algebraic simplification or half-angle identities (AM-GM), both leading to the unique answer 2.", "Difficulty is appropriate for ESAT/ENGAA (Section 1), testing standard trigonometric identities and function properties without a calculator.", "Distractors cover common algebraic slips (missing the factor of 2) and evaluation errors."], "_raw_text": "verdict: PASS\nconfidence: high\nnotes:\n  - The mathematical derivation is correct and robust.\n  - The question can be solved via algebraic simplification or half-angle identities (AM-GM), both leading to the unique answer 2.\n  - Difficulty is appropriate for ESAT/ENGAA (Section 1), testing standard trigonometric identities and function properties without a calculator.\n  - Distractors cover common algebraic slips (missing the factor of 2) and evaluation errors."}, "style_report": {"verdict": "PASS", "scores": {"authenticity": 9, "one_idea_purity": 10, "no_calculator": 10, "elegance": 9, "distractor_realism": 8, "plausibility": 10}, "summary": "This question is an excellent example of an ESAT/ENGAA-style problem. It tests algebraic manipulation of trigonometric functions, knowledge of identities, and understanding of function minima on an interval, all without requiring a calculator. The simplification is elegant, and the distractors target plausible errors.", "_raw_text": "verdict: PASS\nscores:\n  authenticity: 9\n  one_idea_purity: 10\n  no_calculator: 10\n  elegance: 9\n  distractor_realism: 8\n  plausibility: 10\nsummary: >\n  This question is an excellent example of an ESAT/ENGAA-style problem. It tests algebraic manipulation of trigonometric functions, knowledge of identities, and understanding of function minima on an interval, all without requiring a calculator. The simplification is elegant, and the distractors target plausible errors."}, "models": {"designer": "gemini-3-pro-preview", "implementer": "gemini-3-pro-preview", "verifier": "gemini-3-pro-preview", "style_judge": "gemini-2.5-flash"}, "attempts": 1, "created_at": "2025-12-19T02:06:22.244081", "token_usage": {"prompt_tokens": 8401, "candidates_tokens": 1139, "total_tokens": 25058}}
