{"id": "M6-Hard-988b75010a", "schema_id": "M6", "difficulty": "Hard", "idea_plan": {"schema_id": "M6", "idea_summary": "The candidate is asked to evaluate a summation of a seemingly complex function (involving exponentials or radicals) evaluated at a large number of regular intervals. The solution requires recognising a specific symmetry in the function where pairs of terms summing to a fixed constant can be combined, reducing the problem to counting pairs and handling a potential middle term.\n", "function_or_object_type": ["rational function with exponential or trigonometric elements"], "constraints_used": ["symmetry condition (f(x) + f(c-x) = constant)", "inputs form an arithmetic progression"], "what_is_asked": ["determine the exact value of the sum"], "intended_wrong_paths": ["attempting to approximate the sum as an integral (Riemann sum confusion)", "miscounting the number of terms (fencepost error) leading to an incorrect multiplier", "neglecting the middle term if the number of terms is odd", "assuming the series is a standard arithmetic or geometric progression"], "difficulty_rationale": "The function is designed to look algebraically intractable for direct evaluation. The difficulty lies in shifting focus from the function's value to the function's structural symmetry across the domain.\n", "mcq_viability": {"viable": true, "reason": "Errors in counting the number of terms or handling the middle term naturally result in answers differing by integers or halves, creating tight, plausible distractors."}, "_raw_text": "```yaml\nschema_id: M6\nidea_summary: >\n  The candidate is asked to evaluate a summation of a seemingly complex function (involving exponentials or radicals) evaluated at a large number of regular intervals. The solution requires recognising a specific symmetry in the function where pairs of terms summing to a fixed constant can be combined, reducing the problem to counting pairs and handling a potential middle term.\nfunction_or_object_type:\n  - rational function with exponential or trigonometric elements\nconstraints_used:\n  - symmetry condition (f(x) + f(c-x) = constant)\n  - inputs form an arithmetic progression\nwhat_is_asked:\n  - determine the exact value of the sum\nintended_wrong_paths:\n  - attempting to approximate the sum as an integral (Riemann sum confusion)\n  - miscounting the number of terms (fencepost error) leading to an incorrect multiplier\n  - neglecting the middle term if the number of terms is odd\n  - assuming the series is a standard arithmetic or geometric progression\ndifficulty_rationale: >\n  The function is designed to look algebraically intractable for direct evaluation. The difficulty lies in shifting focus from the function's value to the function's structural symmetry across the domain.\nmcq_viability:\n  viable: yes\n  reason: >\n    Errors in counting the number of terms or handling the middle term naturally result in answers differing by integers or halves, creating tight, plausible distractors.\n```"}, "question_package": {"question": {"stem": "The function$f(x)$is defined by$$f(x) = \\frac{5^x}{5^x + \\sqrt{5}}$$What is the value of the following sum?$$S = \\sum_{r=0}^{100} f\\left(\\frac{r}{100}\\right)$$", "options": {"A": "49.5", "B": "50", "C": "50.5", "D": "51", "E": "100", "F": "101"}, "correct_option": "C"}, "solution": {"reasoning": "We examine the symmetry of the function by considering$f(x) + f(1-x)$.$$f(1-x) = \\frac{5^{1-x}}{5^{1-x} + \\sqrt{5}} = \\frac{\\frac{5}{5^x}}{\\frac{5}{5^x} + \\sqrt{5}}$$Multiplying the numerator and denominator by$5^x$:$$f(1-x) = \\frac{5}{5 + \\sqrt{5} \\cdot 5^x} = \\frac{5}{\\sqrt{5}(\\sqrt{5} + 5^x)} = \\frac{\\sqrt{5}}{5^x + \\sqrt{5}}$$Adding this to$f(x)$:$$f(x) + f(1-x) = \\frac{5^x}{5^x + \\sqrt{5}} + \\frac{\\sqrt{5}}{5^x + \\sqrt{5}} = \\frac{5^x + \\sqrt{5}}{5^x + \\sqrt{5}} = 1$$The sum contains 101 terms corresponding to$r = 0, 1, \\dots, 100$. We pair terms using the symmetry$x_r + x_{100-r} = \\frac{r}{100} + \\frac{100-r}{100} = 1$. The pairs are$(r=0, r=100), (r=1, r=99), \\dots, (r=49, r=51)$. There are 50 such pairs, each summing to 1. The remaining middle term is at$r=50$, where$x = \\frac{50}{100} = 0.5$:$$f(0.5) = \\frac{5^{0.5}}{5^{0.5} + \\sqrt{5}} = \\frac{\\sqrt{5}}{2\\sqrt{5}} = 0.5$$Thus, the total sum is:$$S = (50 \\times 1) + 0.5 = 50.5$$Hence the correct answer is 50.5.\n", "key_insight": "When summing a function over a symmetric interval, check if$f(x) + f(c-x)$is constant to pair terms efficiently.\n"}, "distractor_map": {"A": "Incorrectly subtracts the middle term or miscounts pairs.", "B": "Corresponds to approximating the sum as an integral ($100 \\times \\int_0^1 f(x)dx = 50$) or neglecting the middle term.", "C": "Correct.", "D": "Fencepost error; incorrectly counting 51 pairs or rounding up the middle term.", "E": "Assumes the sum is simply the number of intervals ($N$) rather than pairs.", "F": "Assumes the sum is the number of terms ($N+1$)."}, "_raw_text": "```yaml\nquestion:\n  stem: >\n    The function $f(x)$ is defined by\n    $$ f(x) = \\frac{5^x}{5^x + \\sqrt{5}} $$\n    What is the value of the following sum?\n    $$ S = \\sum_{r=0}^{100} f\\left(\\frac{r}{100}\\right) $$\n  options:\n    A: 49.5\n    B: 50\n    C: 50.5\n    D: 51\n    E: 100\n    F: 101\n  correct_option: C\nsolution:\n  reasoning: >\n    We examine the symmetry of the function by considering $f(x) + f(1-x)$.\n    $$ f(1-x) = \\frac{5^{1-x}}{5^{1-x} + \\sqrt{5}} = \\frac{\\frac{5}{5^x}}{\\frac{5}{5^x} + \\sqrt{5}} $$\n    Multiplying the numerator and denominator by $5^x$:\n    $$ f(1-x) = \\frac{5}{5 + \\sqrt{5} \\cdot 5^x} = \\frac{5}{\\sqrt{5}(\\sqrt{5} + 5^x)} = \\frac{\\sqrt{5}}{5^x + \\sqrt{5}} $$\n    Adding this to $f(x)$:\n    $$ f(x) + f(1-x) = \\frac{5^x}{5^x + \\sqrt{5}} + \\frac{\\sqrt{5}}{5^x + \\sqrt{5}} = \\frac{5^x + \\sqrt{5}}{5^x + \\sqrt{5}} = 1 $$\n    The sum contains 101 terms corresponding to $r = 0, 1, \\dots, 100$.\n    We pair terms using the symmetry $x_r + x_{100-r} = \\frac{r}{100} + \\frac{100-r}{100} = 1$.\n    The pairs are $(r=0, r=100), (r=1, r=99), \\dots, (r=49, r=51)$.\n    There are 50 such pairs, each summing to 1.\n    The remaining middle term is at $r=50$, where $x = \\frac{50}{100} = 0.5$:\n    $$ f(0.5) = \\frac{5^{0.5}}{5^{0.5} + \\sqrt{5}} = \\frac{\\sqrt{5}}{2\\sqrt{5}} = 0.5 $$\n    Thus, the total sum is:\n    $$ S = (50 \\times 1) + 0.5 = 50.5 $$\n    Hence the correct answer is 50.5.\n  key_insight: >\n    When summing a function over a symmetric interval, check if $f(x) + f(c-x)$ is constant to pair terms efficiently.\ndistractor_map:\n  A: Incorrectly subtracts the middle term or miscounts pairs.\n  B: Corresponds to approximating the sum as an integral ($100 \\times \\int_0^1 f(x)dx = 50$) or neglecting the middle term.\n  C: Correct.\n  D: Fencepost error; incorrectly counting 51 pairs or rounding up the middle term.\n  E: Assumes the sum is simply the number of intervals ($N$) rather than pairs.\n  F: Assumes the sum is the number of terms ($N+1$).\n```"}, "verifier_report": {"verdict": "PASS", "confidence": "high", "notes": ["The mathematical derivation relying on the symmetry $f(x) + f(1-x) = 1$ is correct and standard for this level.", "The calculation of the number of terms (101), pairs (50), and the middle term ($f(0.5)=0.5$) is accurate.", "The question is solvable without a calculator and rewards algebraic insight, fitting the ESAT/ENGAA style perfectly.", "Distractors cover common counting errors (fencepost errors) and misunderstandings of the summation limits."], "_raw_text": "verdict: PASS\nconfidence: high\nnotes:\n  - The mathematical derivation relying on the symmetry $f(x) + f(1-x) = 1$ is correct and standard for this level.\n  - The calculation of the number of terms (101), pairs (50), and the middle term ($f(0.5)=0.5$) is accurate.\n  - The question is solvable without a calculator and rewards algebraic insight, fitting the ESAT/ENGAA style perfectly.\n  - Distractors cover common counting errors (fencepost errors) and misunderstandings of the summation limits."}, "style_report": {"verdict": "PASS", "scores": {"authenticity": 10, "one_idea_purity": 9, "no_calculator": 10, "elegance": 10, "distractor_realism": 9, "plausibility": 10}, "summary": "This question is an excellent example of an ESAT/ENGAA-style problem, testing a classic symmetry trick in summation with clean arithmetic and well-designed distractors. The elegance of the solution and the suitability for a no-calculator environment are particularly strong.", "_raw_text": "verdict: PASS\nscores:\n  authenticity: 10\n  one_idea_purity: 9\n  no_calculator: 10\n  elegance: 10\n  distractor_realism: 9\n  plausibility: 10\nsummary: >\n  This question is an excellent example of an ESAT/ENGAA-style problem, testing a classic symmetry trick in summation with clean arithmetic and well-designed distractors. The elegance of the solution and the suitability for a no-calculator environment are particularly strong."}, "models": {"designer": "gemini-3-pro-preview", "implementer": "gemini-3-pro-preview", "verifier": "gemini-3-pro-preview", "style_judge": "gemini-2.5-flash"}, "attempts": 1, "created_at": "2025-12-19T02:01:42.648878", "token_usage": {"prompt_tokens": 9419, "candidates_tokens": 1404, "total_tokens": 25272}}
